Timestamp,Text,url
37:59:00,say they want a band we're providing the band our kids say they want to travel we're doing the college tours we're,https://www.youtube.com/watch?v=ABsfv6bzOBA&ab_channel=NewOrleansCityCouncil
38:04:00,introducing them to college tours we have football teams doing football season we took our championship teams we,https://www.youtube.com/watch?v=ABsfv6bzOBA&ab_channel=NewOrleansCityCouncil
38:10:00,took 100 kids um to Dallas Texas to Mesquite Texas to,https://www.youtube.com/watch?v=ABsfv6bzOBA&ab_channel=NewOrleansCityCouncil
38:15:00,play against their City Champions and we had a hundred kids in Nord one every,https://www.youtube.com/watch?v=ABsfv6bzOBA&ab_channel=NewOrleansCityCouncil
38:21:00,single game you saw kids that were uh competitors throughout the seasons and,https://www.youtube.com/watch?v=ABsfv6bzOBA&ab_channel=NewOrleansCityCouncil
38:26:00,opponents against the seasons create friendships and this was all paid for by the City of New Orleans and I have to,https://www.youtube.com/watch?v=ABsfv6bzOBA&ab_channel=NewOrleansCityCouncil
38:32:00,acknowledge Alvin Kamara who donated ten thousand dollars for that event to make,https://www.youtube.com/watch?v=ABsfv6bzOBA&ab_channel=NewOrleansCityCouncil
38:38:00,sure that that happened it was a beautiful event the parents who drove out there loved it the kids they loved,https://www.youtube.com/watch?v=ABsfv6bzOBA&ab_channel=NewOrleansCityCouncil
38:45:00,it and you saw friendships being formed of kids from Algiers to New Orleans East become friends doing this experience,https://www.youtube.com/watch?v=ABsfv6bzOBA&ab_channel=NewOrleansCityCouncil
38:57:00,councilmember King can you give us an update on the uh situation with the pool at Berman uh Morris FX Jeff will be,https://www.youtube.com/watch?v=ABsfv6bzOBA&ab_channel=NewOrleansCityCouncil
39:04:00,using Federal City again or is there any plans or movement on updated pool,https://www.youtube.com/watch?v=ABsfv6bzOBA&ab_channel=NewOrleansCityCouncil
39:11:00,so at at this point um we're still having um conversations with uh LG's development District it is,https://www.youtube.com/watch?v=ABsfv6bzOBA&ab_channel=NewOrleansCityCouncil
39:20:00,not in stone um of course as as you were aware uh we the the bids went out to,https://www.youtube.com/watch?v=ABsfv6bzOBA&ab_channel=NewOrleansCityCouncil
39:27:00,renovate the pools at Berman and the bids came in extremely over our budget,https://www.youtube.com/watch?v=ABsfv6bzOBA&ab_channel=NewOrleansCityCouncil
39:34:00,so I know capital projects in the city is trying additional trying to identify the additional funds so that we can,https://www.youtube.com/watch?v=ABsfv6bzOBA&ab_channel=NewOrleansCityCouncil
39:41:00,renovate on renovate and enclose that pool but so right now we're still having,https://www.youtube.com/watch?v=ABsfv6bzOBA&ab_channel=NewOrleansCityCouncil
39:46:00,the conversations with Algiers development District about going back to Federal City,https://www.youtube.com/watch?v=ABsfv6bzOBA&ab_channel=NewOrleansCityCouncil
39:55:00,any other comments from Council Members um Mr barabuna first of all thank you uh,https://www.youtube.com/watch?v=ABsfv6bzOBA&ab_channel=NewOrleansCityCouncil
40:00:00,again uh for the programs that you guys run as as well as preparing for the,https://www.youtube.com/watch?v=ABsfv6bzOBA&ab_channel=NewOrleansCityCouncil
40:05:00,summer program when we enter the budget process I know the increase in funding uh at this Council allocated towards,https://www.youtube.com/watch?v=ABsfv6bzOBA&ab_channel=NewOrleansCityCouncil
40:12:00,north uh they had a lot to do with Nord but it also had a lot to do with prevention yes and in intervention can,https://www.youtube.com/watch?v=ABsfv6bzOBA&ab_channel=NewOrleansCityCouncil
40:18:00,you talk about specifically some of the new programs that are that are going to align with that new funding that will go,https://www.youtube.com/watch?v=ABsfv6bzOBA&ab_channel=NewOrleansCityCouncil
40:24:00,in line to helping prevent youth uh teen and juvenile crime sure sure so then and,https://www.youtube.com/watch?v=ABsfv6bzOBA&ab_channel=NewOrleansCityCouncil
40:29:00,it goes back to some of the things that we're looking to do is is is again you know we're talking to a lot of our teams,https://www.youtube.com/watch?v=ABsfv6bzOBA&ab_channel=NewOrleansCityCouncil
40:35:00,one of the key things it says is I need money I need money so some of the key things we did is we took and put funds into,https://www.youtube.com/watch?v=ABsfv6bzOBA&ab_channel=NewOrleansCityCouncil
40:42:00,stipend programs where we have uh spring and fall internships where we're looking,https://www.youtube.com/watch?v=ABsfv6bzOBA&ab_channel=NewOrleansCityCouncil
40:48:00,to take a couple of hundred kids and they'll allow them to make up to 600 and,https://www.youtube.com/watch?v=ABsfv6bzOBA&ab_channel=NewOrleansCityCouncil
40:55:00,I think it's up six hundred and forty dollars during the Spring and Summer doing internship opportunities that,https://www.youtube.com/watch?v=ABsfv6bzOBA&ab_channel=NewOrleansCityCouncil
41:01:00,means that we're taking young men that wants to know more about sports and we're able to put them into Athletics uh,https://www.youtube.com/watch?v=ABsfv6bzOBA&ab_channel=NewOrleansCityCouncil
41:06:00,division to work and assist Athletics so those that's interested in doing working in other components we're looking to do,https://www.youtube.com/watch?v=ABsfv6bzOBA&ab_channel=NewOrleansCityCouncil
41:12:00,that we're also looking to expand as relates to bringing in uh the the team,https://www.youtube.com/watch?v=ABsfv6bzOBA&ab_channel=NewOrleansCityCouncil
41:18:00,um dances to try to get them off the streets trying to expand that with them also with that we're bringing in more,https://www.youtube.com/watch?v=ABsfv6bzOBA&ab_channel=NewOrleansCityCouncil
41:25:00,partners and we're expanding our Partnerships uh we're open to continuous Partnerships as we are always saying we,https://www.youtube.com/watch?v=ABsfv6bzOBA&ab_channel=NewOrleansCityCouncil
41:32:00,put it out um so again we're expanding what we do with uh we're expanding the,https://www.youtube.com/watch?v=ABsfv6bzOBA&ab_channel=NewOrleansCityCouncil
41:37:00,Esports component on trying to get kids off the streets and the Esports is not just about coming play the game it's,https://www.youtube.com/watch?v=ABsfv6bzOBA&ab_channel=NewOrleansCityCouncil
41:43:00,about learning uh the learning the games it's about coding it's about you know,https://www.youtube.com/watch?v=ABsfv6bzOBA&ab_channel=NewOrleansCityCouncil
41:49:00,it's about and also it's about competing with persons locally in in a way as it,https://www.youtube.com/watch?v=ABsfv6bzOBA&ab_channel=NewOrleansCityCouncil
41:55:00,relates to the Esports where competitions and challenges but the key thing that we're trying to do is we're,https://www.youtube.com/watch?v=ABsfv6bzOBA&ab_channel=NewOrleansCityCouncil
42:00:00,expanding with the music program and we're trying to offer them what they say they want but the key thing about it is,https://www.youtube.com/watch?v=ABsfv6bzOBA&ab_channel=NewOrleansCityCouncil
42:07:00,is we're putting funding there to where that our teams can receive stipends on,https://www.youtube.com/watch?v=ABsfv6bzOBA&ab_channel=NewOrleansCityCouncil
42:14:00,for participating especially our teams to receive stipends for participating in our program and so we're we're uh,https://www.youtube.com/watch?v=ABsfv6bzOBA&ab_channel=NewOrleansCityCouncil
42:21:00,encouraging them to be a part of different things whether it's the the summer on Sports challenge you know we,https://www.youtube.com/watch?v=ABsfv6bzOBA&ab_channel=NewOrleansCityCouncil
42:28:00,encourage them to be a part by putting 400 in for those that's participating in 707 and five on five we're encouraging,https://www.youtube.com/watch?v=ABsfv6bzOBA&ab_channel=NewOrleansCityCouncil
42:34:00,them to be a part of and and the incentive is the the stipends that we're,https://www.youtube.com/watch?v=ABsfv6bzOBA&ab_channel=NewOrleansCityCouncil
42:40:00,giving them and that's something that we've never done that nor have we done in uh an area code a zip code I mean a,https://www.youtube.com/watch?v=ABsfv6bzOBA&ab_channel=NewOrleansCityCouncil
42:47:00,zip code uh study to determine first of all where,https://www.youtube.com/watch?v=ABsfv6bzOBA&ab_channel=NewOrleansCityCouncil
42:52:00,the kids are coming from as well as the areas where kids probably need more,https://www.youtube.com/watch?v=ABsfv6bzOBA&ab_channel=NewOrleansCityCouncil
42:57:00,organized activity so that when we're putting together programs we can Target some of those hot spots in some of those,https://www.youtube.com/watch?v=ABsfv6bzOBA&ab_channel=NewOrleansCityCouncil
43:03:00,communities do we know exactly where the kids are coming from and do we know where we would like the kids to come,https://www.youtube.com/watch?v=ABsfv6bzOBA&ab_channel=NewOrleansCityCouncil
43:10:00,from especially with intervention and prevention sure so so so we know where they're coming from when they're,https://www.youtube.com/watch?v=ABsfv6bzOBA&ab_channel=NewOrleansCityCouncil
43:15:00,registering with us by the ZIP codes one thing that we do is we always make sure that we have something in New Orleans,https://www.youtube.com/watch?v=ABsfv6bzOBA&ab_channel=NewOrleansCityCouncil
43:22:00,East you know we always make sure that we're utilizing Joe Brown and we're bringing in more programs and we're,https://www.youtube.com/watch?v=ABsfv6bzOBA&ab_channel=NewOrleansCityCouncil
43:28:00,bringing in more opportunities as it relates for uh for our teams out of New Orleans East so Joe Brown is that hub,https://www.youtube.com/watch?v=ABsfv6bzOBA&ab_channel=NewOrleansCityCouncil
43:35:00,for that that covers New Orleans East we always make sure that we're pushing and looking at,https://www.youtube.com/watch?v=ABsfv6bzOBA&ab_channel=NewOrleansCityCouncil
43:41:00,um and Algiers whether it's cut off or a Berman which is I mean Mars Jeff but cut,https://www.youtube.com/watch?v=ABsfv6bzOBA&ab_channel=NewOrleansCityCouncil
43:47:00,off have been more of a focus in that area based upon the what the kids are and what we know the need is more in,https://www.youtube.com/watch?v=ABsfv6bzOBA&ab_channel=NewOrleansCityCouncil
43:54:00,that area there and when it comes to Inner City we always look at Rosenwald on in that area we always look at trying,https://www.youtube.com/watch?v=ABsfv6bzOBA&ab_channel=NewOrleansCityCouncil
44:01:00,to make sure that we're catching line Center and we're always looking to catch in Mid-City out of Gentilly area so,https://www.youtube.com/watch?v=ABsfv6bzOBA&ab_channel=NewOrleansCityCouncil
44:07:00,we're looking at the ZIP codes of the kids that's coming in with us we're paying attention to different spots as,https://www.youtube.com/watch?v=ABsfv6bzOBA&ab_channel=NewOrleansCityCouncil
44:14:00,it relates to where you're seeing activity and that's what we're looking to continue to expand programmings where,https://www.youtube.com/watch?v=ABsfv6bzOBA&ab_channel=NewOrleansCityCouncil
44:21:00,we do have the capabilities of putting a footprint however we also look for partners that are in different ZIP codes,https://www.youtube.com/watch?v=ABsfv6bzOBA&ab_channel=NewOrleansCityCouncil
44:27:00,in different areas that want to be engaged and be a Partners but nor we're open for more Partnerships,https://www.youtube.com/watch?v=ABsfv6bzOBA&ab_channel=NewOrleansCityCouncil
44:34:00,uh one of the things we hear parents talk about uh I guess it's almost like a,https://www.youtube.com/watch?v=ABsfv6bzOBA&ab_channel=NewOrleansCityCouncil
44:40:00,a couple of uh things in America that really don't exist anymore uh,https://www.youtube.com/watch?v=ABsfv6bzOBA&ab_channel=NewOrleansCityCouncil
44:47:00,customer service thing what it used to be in fast food any phase it's just your order and wait and then,https://www.youtube.com/watch?v=ABsfv6bzOBA&ab_channel=NewOrleansCityCouncil
44:54:00,the other thing is some of us summer program uh is it me is it the parents we talk to,https://www.youtube.com/watch?v=ABsfv6bzOBA&ab_channel=NewOrleansCityCouncil
45:01:00,or is summer program now just part of the Summers because what we hear from a,https://www.youtube.com/watch?v=ABsfv6bzOBA&ab_channel=NewOrleansCityCouncil
45:06:00,lot of parents especially those who put their kids in private programs it's like they'll put them in for part of the,https://www.youtube.com/watch?v=ABsfv6bzOBA&ab_channel=NewOrleansCityCouncil
45:11:00,summer then there's that costs that comes for those last few weeks which is almost more than the cost for,https://www.youtube.com/watch?v=ABsfv6bzOBA&ab_channel=NewOrleansCityCouncil
45:19:00,those few weeks in the beginning of the summer right talk about the length of the summer how Nord complements or,https://www.youtube.com/watch?v=ABsfv6bzOBA&ab_channel=NewOrleansCityCouncil
45:25:00,organizers around those other camps because increasingly people are saying hey look,https://www.youtube.com/watch?v=ABsfv6bzOBA&ab_channel=NewOrleansCityCouncil
45:31:00,uh the summer ain't nowhere near over and summer camp,https://www.youtube.com/watch?v=ABsfv6bzOBA&ab_channel=NewOrleansCityCouncil
45:37:00,is over uh how do we organize that or how do we create in such a way where,https://www.youtube.com/watch?v=ABsfv6bzOBA&ab_channel=NewOrleansCityCouncil
45:42:00,summer camp actually means summer maybe with a week for kids to get to get ready for school sure not like a bait and then,https://www.youtube.com/watch?v=ABsfv6bzOBA&ab_channel=NewOrleansCityCouncil
45:51:00,you come back and those last couple weeks cost a whole lot of money for families who really would hope that,https://www.youtube.com/watch?v=ABsfv6bzOBA&ab_channel=NewOrleansCityCouncil
45:57:00,summer camp would have been the entire summer sure sure so so so what we and we definitely can can look at that,https://www.youtube.com/watch?v=ABsfv6bzOBA&ab_channel=NewOrleansCityCouncil
46:04:00,um because when we're looking at it we operate the entire months of June and,https://www.youtube.com/watch?v=ABsfv6bzOBA&ab_channel=NewOrleansCityCouncil
46:09:00,July one thing that we take into accounting consideration is that we don't have one school system anymore so,https://www.youtube.com/watch?v=ABsfv6bzOBA&ab_channel=NewOrleansCityCouncil
46:16:00,you have some schools that start the first week of August you have some school that might start the third or,https://www.youtube.com/watch?v=ABsfv6bzOBA&ab_channel=NewOrleansCityCouncil
46:23:00,fourth week of August it's so sporadic how the charter schools start their school year some start as early as,https://www.youtube.com/watch?v=ABsfv6bzOBA&ab_channel=NewOrleansCityCouncil
46:30:00,August 1st and some start as late as August 21st um and so that's the challenge that,https://www.youtube.com/watch?v=ABsfv6bzOBA&ab_channel=NewOrleansCityCouncil
46:37:00,allow a parent's face um but our camps run primarily uh up to eight weeks,https://www.youtube.com/watch?v=ABsfv6bzOBA&ab_channel=NewOrleansCityCouncil
46:42:00,during the months of of June and July that it covered those months however we,https://www.youtube.com/watch?v=ABsfv6bzOBA&ab_channel=NewOrleansCityCouncil
46:48:00,can look at because we do have a healthy enough budget where that if we can and,https://www.youtube.com/watch?v=ABsfv6bzOBA&ab_channel=NewOrleansCityCouncil
46:53:00,if our partners that are at the table we can expand the the length of time that,https://www.youtube.com/watch?v=ABsfv6bzOBA&ab_channel=NewOrleansCityCouncil
46:58:00,it can't run that's something that we can look at I would hope that we would because increasingly time and time again,https://www.youtube.com/watch?v=ABsfv6bzOBA&ab_channel=NewOrleansCityCouncil
47:04:00,uh the cost of summer activity is seems to be going up right and then the length,https://www.youtube.com/watch?v=ABsfv6bzOBA&ab_channel=NewOrleansCityCouncil
47:10:00,of time for the camps seem to be shortening right so I would appreciate you guys taking a look at that maybe,https://www.youtube.com/watch?v=ABsfv6bzOBA&ab_channel=NewOrleansCityCouncil
47:17:00,doing the study and coming back and Reporting uh not just to this committee but to uh the entire Council uh another,https://www.youtube.com/watch?v=ABsfv6bzOBA&ab_channel=NewOrleansCityCouncil
47:24:00,issue uh in meeting with and talking to coaches how do we uh,https://www.youtube.com/watch?v=ABsfv6bzOBA&ab_channel=NewOrleansCityCouncil
47:30:00,sweeten the pot or offer more money especially for the,https://www.youtube.com/watch?v=ABsfv6bzOBA&ab_channel=NewOrleansCityCouncil
47:36:00,those dedicated coaches and those quality coaches and maybe during the summer to attract some of those,https://www.youtube.com/watch?v=ABsfv6bzOBA&ab_channel=NewOrleansCityCouncil
47:43:00,High School coaches who are not doing travel ball or Au ball who like back in,https://www.youtube.com/watch?v=ABsfv6bzOBA&ab_channel=NewOrleansCityCouncil
47:48:00,the day when I was involved in Norwood actually coach and US many would volunteer at the,https://www.youtube.com/watch?v=ABsfv6bzOBA&ab_channel=NewOrleansCityCouncil
47:54:00,recreation department sure so one thing that we look at and part of the challenge that we know it specifically,https://www.youtube.com/watch?v=ABsfv6bzOBA&ab_channel=NewOrleansCityCouncil
48:01:00,are faced in the,https://www.youtube.com/watch?v=ABsfv6bzOBA&ab_channel=NewOrleansCityCouncil
48:07:00,you worked in the school system and you worked at North during summer months the Educators all worked at Norwood but,https://www.youtube.com/watch?v=ABsfv6bzOBA&ab_channel=NewOrleansCityCouncil
48:14:00,doing covet uh the schools because they received the federal funds they opened,https://www.youtube.com/watch?v=ABsfv6bzOBA&ab_channel=NewOrleansCityCouncil
48:19:00,during summer months which left us a shortage of having left us a shortage of being able to hire those Educators who,https://www.youtube.com/watch?v=ABsfv6bzOBA&ab_channel=NewOrleansCityCouncil
48:26:00,normally worked for Noah well we're hearing this summer we'll be successful at hiring more so I encourage those,https://www.youtube.com/watch?v=ABsfv6bzOBA&ab_channel=NewOrleansCityCouncil
48:33:00,coaches that that especially if they want to work during summer months um and to apply we're looking to hire uh,https://www.youtube.com/watch?v=ABsfv6bzOBA&ab_channel=NewOrleansCityCouncil
48:42:00,staff during summer months to be a part of the camps and Etc but also what we're looking to do is we're looking and we're,https://www.youtube.com/watch?v=ABsfv6bzOBA&ab_channel=NewOrleansCityCouncil
48:48:00,having the conversations with certain High School coaching staff that want to come out and host clinics and camps for,https://www.youtube.com/watch?v=ABsfv6bzOBA&ab_channel=NewOrleansCityCouncil
48:55:00,our kids uh this summer so that's part of the conversations that we're having as well because a lot of our schools are,https://www.youtube.com/watch?v=ABsfv6bzOBA&ab_channel=NewOrleansCityCouncil
49:03:00,looking to expand with having ninth grade teams and Etc so they want to come in and those camps and Clinics and those,https://www.youtube.com/watch?v=ABsfv6bzOBA&ab_channel=NewOrleansCityCouncil
49:09:00,are the kind of the Partnerships that we definitely look forward to and we and we have a couple of schools that have contacted us coaching staffs that's,https://www.youtube.com/watch?v=ABsfv6bzOBA&ab_channel=NewOrleansCityCouncil
49:16:00,looking to do that this year so how do we compare with other cities uh their,https://www.youtube.com/watch?v=ABsfv6bzOBA&ab_channel=NewOrleansCityCouncil
49:21:00,recreation department when you talk about paying our coaches versus have we done a comparison on our national uh,https://www.youtube.com/watch?v=ABsfv6bzOBA&ab_channel=NewOrleansCityCouncil
49:27:00,study on that we haven't done a comparison but I could tell you from being a part of the nrpa panel on,https://www.youtube.com/watch?v=ABsfv6bzOBA&ab_channel=NewOrleansCityCouncil
49:35:00,national election Parks Association panel um it's in every Park in Rec system the,https://www.youtube.com/watch?v=ABsfv6bzOBA&ab_channel=NewOrleansCityCouncil
49:42:00,most successful parks and recs programs have strong volunteers whether it's,https://www.youtube.com/watch?v=ABsfv6bzOBA&ab_channel=NewOrleansCityCouncil
49:47:00,parents or Etc um but they have strong core volunteers the most successful playgrounds in the,https://www.youtube.com/watch?v=ABsfv6bzOBA&ab_channel=NewOrleansCityCouncil
49:54:00,City of New Orleans are based behind based upon a strong volunteer coaches and Etc so uh but we always look at ways,https://www.youtube.com/watch?v=ABsfv6bzOBA&ab_channel=NewOrleansCityCouncil
50:02:00,on for example we do different things for our coaches appreciations we find different ways to give them on different,https://www.youtube.com/watch?v=ABsfv6bzOBA&ab_channel=NewOrleansCityCouncil
50:10:00,um by the events by the tokens of appreciation and Etc,https://www.youtube.com/watch?v=ABsfv6bzOBA&ab_channel=NewOrleansCityCouncil
50:15:00,yeah uh thank you any other uh comments or questions from Council councilmember,https://www.youtube.com/watch?v=ABsfv6bzOBA&ab_channel=NewOrleansCityCouncil
50:21:00,case it's just sent to me um does not have a uh chess or a debate team if so,https://www.youtube.com/watch?v=ABsfv6bzOBA&ab_channel=NewOrleansCityCouncil
50:27:00,is it possible to think about getting those two teams sure so so Lord did have,https://www.youtube.com/watch?v=ABsfv6bzOBA&ab_channel=NewOrleansCityCouncil
50:33:00,a real strong chess program with a partnership a partnership with the young,https://www.youtube.com/watch?v=ABsfv6bzOBA&ab_channel=NewOrleansCityCouncil
50:38:00,man Kendrick and I can't think of his last name he it was last year he took a break because he's working on his,https://www.youtube.com/watch?v=ABsfv6bzOBA&ab_channel=NewOrleansCityCouncil
50:44:00,doctoral degree but for for years we have had a very strong chess program,https://www.youtube.com/watch?v=ABsfv6bzOBA&ab_channel=NewOrleansCityCouncil
50:50:00,um and and Kendall um Kendrick I'm sorry is he said he's coming back once he finished,https://www.youtube.com/watch?v=ABsfv6bzOBA&ab_channel=NewOrleansCityCouncil
50:55:00,um but this is a very bright young man he goes from Center to Center teaching chess holding chess competitions,https://www.youtube.com/watch?v=ABsfv6bzOBA&ab_channel=NewOrleansCityCouncil
51:02:00,um but he's working on his doctoral degree but however we're always open we're open for anyone that wants to come,https://www.youtube.com/watch?v=ABsfv6bzOBA&ab_channel=NewOrleansCityCouncil
51:08:00,in on and partner with Noah whether we're creating debate teams whether we're creating a North choir whether,https://www.youtube.com/watch?v=ABsfv6bzOBA&ab_channel=NewOrleansCityCouncil
51:14:00,we're creating any program is going to be hiring let me say this it's one thing yes we always look for volunteers but as,https://www.youtube.com/watch?v=ABsfv6bzOBA&ab_channel=NewOrleansCityCouncil
51:21:00,I indicated earlier we're hiring we have positions available to hire people with,https://www.youtube.com/watch?v=ABsfv6bzOBA&ab_channel=NewOrleansCityCouncil
51:26:00,skill sets that want to be a part and want to start new programming with Noah,https://www.youtube.com/watch?v=ABsfv6bzOBA&ab_channel=NewOrleansCityCouncil
51:32:00,thank you Mr parabino any closing comments you have no I just want to thank you guys for again your continued,https://www.youtube.com/watch?v=ABsfv6bzOBA&ab_channel=NewOrleansCityCouncil
51:38:00,support and coming out and supporting everyone for the different activities we have in nursing I just want to make sure,https://www.youtube.com/watch?v=ABsfv6bzOBA&ab_channel=NewOrleansCityCouncil
51:43:00,you guys aware that I'm a phone call away to come out and work with you guys on any whether it's a meeting or,https://www.youtube.com/watch?v=ABsfv6bzOBA&ab_channel=NewOrleansCityCouncil
51:49:00,anything to come out I'm always open and willing to work with you guys because you all are willing to work with me thank you thank you thank you next item,https://www.youtube.com/watch?v=ABsfv6bzOBA&ab_channel=NewOrleansCityCouncil
51:56:00,on the agenda foreign,https://www.youtube.com/watch?v=ABsfv6bzOBA&ab_channel=NewOrleansCityCouncil
52:03:00,okay,https://www.youtube.com/watch?v=ABsfv6bzOBA&ab_channel=NewOrleansCityCouncil
52:09:00,um we have Thrive New Orleans discussion about how Thrive contributes to creating a better community and how,https://www.youtube.com/watch?v=ABsfv6bzOBA&ab_channel=NewOrleansCityCouncil
52:15:00,its pro programs the system reducing crime while providing opportunities for the Youth through conflict we have the,https://www.youtube.com/watch?v=ABsfv6bzOBA&ab_channel=NewOrleansCityCouncil
52:21:00,representatives from five ready to present not ready okay all right uh uh next uh,https://www.youtube.com/watch?v=ABsfv6bzOBA&ab_channel=NewOrleansCityCouncil
52:28:00,the youth number four the Youth Empowerment project uh Ms chabra Johnson and Mr August Collins,https://www.youtube.com/watch?v=ABsfv6bzOBA&ab_channel=NewOrleansCityCouncil
52:53:00,foreign,https://www.youtube.com/watch?v=ABsfv6bzOBA&ab_channel=NewOrleansCityCouncil
53:03:00,guys good morning and uh thank you all for agreeing to be part of uh uh this,https://www.youtube.com/watch?v=ABsfv6bzOBA&ab_channel=NewOrleansCityCouncil
53:09:00,presentation that talks about prevention and intervention as much as we talk about law enforcement and apprehension,https://www.youtube.com/watch?v=ABsfv6bzOBA&ab_channel=NewOrleansCityCouncil
53:15:00,so if you guys can start your presentation how you doing good morning my name is Elvis Jake Collins the Youth,https://www.youtube.com/watch?v=ABsfv6bzOBA&ab_channel=NewOrleansCityCouncil
