Timestamp,Text,url
2:08:07,we have to be able to connect those services like I said earlier not one person organization or resource is going,https://www.youtube.com/watch?v=ABsfv6bzOBA&ab_channel=NewOrleansCityCouncil
2:08:14,to fix the amount of crime and issues our community is facing without you right now but thank you you know things,https://www.youtube.com/watch?v=ABsfv6bzOBA&ab_channel=NewOrleansCityCouncil
2:08:21,happen in uh God's time it's not always in our time and much of what's been said,https://www.youtube.com/watch?v=ABsfv6bzOBA&ab_channel=NewOrleansCityCouncil
2:08:26,over the last couple years now I think the time is right now what we do know is everybody working individually this,https://www.youtube.com/watch?v=ABsfv6bzOBA&ab_channel=NewOrleansCityCouncil
2:08:34,agency that agency this politician that politician this organization hasn't solved the problem so it's going to only,https://www.youtube.com/watch?v=ABsfv6bzOBA&ab_channel=NewOrleansCityCouncil
2:08:40,be be a collective effort not only with people like you but there's others we need to bring to the table so I'm,https://www.youtube.com/watch?v=ABsfv6bzOBA&ab_channel=NewOrleansCityCouncil
2:08:46,looking forward to that uh I feel a spirit of cooperation like I haven't seen in about a year so looking forward,https://www.youtube.com/watch?v=ABsfv6bzOBA&ab_channel=NewOrleansCityCouncil
2:08:52,to looking forward to you helping us make a difference thank you thank you council members,https://www.youtube.com/watch?v=ABsfv6bzOBA&ab_channel=NewOrleansCityCouncil
2:09:00,next item next item is ordinance calendar number 33 994 from Council Members green King,https://www.youtube.com/watch?v=ABsfv6bzOBA&ab_channel=NewOrleansCityCouncil
2:09:08,and Thomas by requests an ordinance to amend reordain section 2 975 article 10,https://www.youtube.com/watch?v=ABsfv6bzOBA&ab_channel=NewOrleansCityCouncil
2:09:14,of chapter 2 of the code of the City of New Orleans to exempt Juvenile Detention officers and Corrections staff of the,https://www.youtube.com/watch?v=ABsfv6bzOBA&ab_channel=NewOrleansCityCouncil
2:09:19,Juvenile Justice intervention Center and automotive repair staff of the equipment maintenance division from the city's,https://www.youtube.com/watch?v=ABsfv6bzOBA&ab_channel=NewOrleansCityCouncil
2:09:25,domicile requirement and otherwise to provide with respect there too fellow council member council member green,https://www.youtube.com/watch?v=ABsfv6bzOBA&ab_channel=NewOrleansCityCouncil
2:09:32,forward so the bigger guys if y'all could come to the dead yes to the table fellow council members um I speak often,https://www.youtube.com/watch?v=ABsfv6bzOBA&ab_channel=NewOrleansCityCouncil
2:09:40,about um certainly building city jobs because they're good jobs they always have minimum pay include employment and,https://www.youtube.com/watch?v=ABsfv6bzOBA&ab_channel=NewOrleansCityCouncil
2:09:47,retirement benefits um the most important thing is sometimes those jobs need to be filled because,https://www.youtube.com/watch?v=ABsfv6bzOBA&ab_channel=NewOrleansCityCouncil
2:09:52,they can help us to achieve certain goals that we wish to achieve and in,https://www.youtube.com/watch?v=ABsfv6bzOBA&ab_channel=NewOrleansCityCouncil
2:09:58,this particular case I bring to you an ordinance to waive a domicile requirement for the Juvenile Justice,https://www.youtube.com/watch?v=ABsfv6bzOBA&ab_channel=NewOrleansCityCouncil
2:10:06,intervention Center offices they're in need of offices at this time I understand the sensitivity and I'd,https://www.youtube.com/watch?v=ABsfv6bzOBA&ab_channel=NewOrleansCityCouncil
2:10:12,like to see all New Orleans fill those jobs so but it does include a Sunset date of December 31st,https://www.youtube.com/watch?v=ABsfv6bzOBA&ab_channel=NewOrleansCityCouncil
2:10:19,2024 so it's a basically a two-year attempt to fill some of those important,https://www.youtube.com/watch?v=ABsfv6bzOBA&ab_channel=NewOrleansCityCouncil
2:10:24,jobs I know that there was some sensitivities relative to the Juvenile Justice intervention Center so I asked,https://www.youtube.com/watch?v=ABsfv6bzOBA&ab_channel=NewOrleansCityCouncil
2:10:30,Ms DeShawn Williams and Mr John Thomas Ms Williams the executive director of,https://www.youtube.com/watch?v=ABsfv6bzOBA&ab_channel=NewOrleansCityCouncil
2:10:36,the Juvenile Justice intervention Center Carolina Council and also Mr Thomas yes,https://www.youtube.com/watch?v=ABsfv6bzOBA&ab_channel=NewOrleansCityCouncil
2:10:41,Homeland Security yes sir thank you Mr Eugene green um this is uh was deferred the last time,https://www.youtube.com/watch?v=ABsfv6bzOBA&ab_channel=NewOrleansCityCouncil
2:10:48,and you are reintroduced so we appreciate that with a Sunset date uh councilman by Oliver Thomas had,https://www.youtube.com/watch?v=ABsfv6bzOBA&ab_channel=NewOrleansCityCouncil
2:10:53,recommended uh the Sunset date and we originally put December of 2026 uh,https://www.youtube.com/watch?v=ABsfv6bzOBA&ab_channel=NewOrleansCityCouncil
2:10:59,councilman mcgreen amended it to December 2024 and we are in agreement with that that's a two-year date uh we,https://www.youtube.com/watch?v=ABsfv6bzOBA&ab_channel=NewOrleansCityCouncil
2:11:06,always have the interest of Hiring Our locals first and we do that uh Mr,https://www.youtube.com/watch?v=ABsfv6bzOBA&ab_channel=NewOrleansCityCouncil
2:11:12,Williams uh councilman Moreno is now our director of jjicic last time we came,https://www.youtube.com/watch?v=ABsfv6bzOBA&ab_channel=NewOrleansCityCouncil
2:11:19,here she was the interim director she has been appointed as the Director of jjicic thank you thank you and she was,https://www.youtube.com/watch?v=ABsfv6bzOBA&ab_channel=NewOrleansCityCouncil
2:11:25,doing an excellent job I appreciate that uh last time on Mr morale we talked,https://www.youtube.com/watch?v=ABsfv6bzOBA&ab_channel=NewOrleansCityCouncil
2:11:31,about EMD we had the job series it was being studied by civil service that has,https://www.youtube.com/watch?v=ABsfv6bzOBA&ab_channel=NewOrleansCityCouncil
2:11:36,been completed all our EMD current workers now has been moved over to the new series and that came with an,https://www.youtube.com/watch?v=ABsfv6bzOBA&ab_channel=NewOrleansCityCouncil
2:11:42,increase in Pay we're currently doing interviews this week to get our boost our staff members over there JJ RC is,https://www.youtube.com/watch?v=ABsfv6bzOBA&ab_channel=NewOrleansCityCouncil
2:11:49,doing interviews Monday Wednesday and Friday we also have an increase in uh Personnel that being updated weekly,https://www.youtube.com/watch?v=ABsfv6bzOBA&ab_channel=NewOrleansCityCouncil
2:11:56,there so we've seen an increase in hiring at JJ jjic as well as EMD so we,https://www.youtube.com/watch?v=ABsfv6bzOBA&ab_channel=NewOrleansCityCouncil
2:12:02,appreciate this ordinance being waived but we're still constantly looking for,https://www.youtube.com/watch?v=ABsfv6bzOBA&ab_channel=NewOrleansCityCouncil
2:12:07,people when we hiring people and Mr Green we appreciate you advocating for people uh getting jobs with the city and,https://www.youtube.com/watch?v=ABsfv6bzOBA&ab_channel=NewOrleansCityCouncil
2:12:15,we appreciate every opportunity we get to go to any job fairs and we are constantly out there trying to get,https://www.youtube.com/watch?v=ABsfv6bzOBA&ab_channel=NewOrleansCityCouncil
2:12:20,people to come and work for our jdc as well as EMD because we know EMD is a support our First Responders we have to,https://www.youtube.com/watch?v=ABsfv6bzOBA&ab_channel=NewOrleansCityCouncil
2:12:26,get these vehicles fixed we have Mardi Gras coming out we have heavy equipment we have the first response we have,https://www.youtube.com/watch?v=ABsfv6bzOBA&ab_channel=NewOrleansCityCouncil
2:12:32,police EMS fire department as well as other City agencies that requires Vehicles just the Personnel is not the,https://www.youtube.com/watch?v=ABsfv6bzOBA&ab_channel=NewOrleansCityCouncil
2:12:39,only thing we have to get them to and from where we need to get to and we need vehicles to do that so that being said,https://www.youtube.com/watch?v=ABsfv6bzOBA&ab_channel=NewOrleansCityCouncil
2:12:44,if y'all have any questions for Mr Shell she's working diligently getting people hired as well as EMD if y'all have any,https://www.youtube.com/watch?v=ABsfv6bzOBA&ab_channel=NewOrleansCityCouncil
2:12:50,questions as relates to that I appreciate you uh introducing this Artemis Mr Green council member Harris,https://www.youtube.com/watch?v=ABsfv6bzOBA&ab_channel=NewOrleansCityCouncil
2:12:57,I have a sense of how many applicants are have applied here or not in New Orleans but who are out at domicile,https://www.youtube.com/watch?v=ABsfv6bzOBA&ab_channel=NewOrleansCityCouncil
2:13:04,so jjicic doesn't govern that we applicants fill out through the Civil,https://www.youtube.com/watch?v=ABsfv6bzOBA&ab_channel=NewOrleansCityCouncil
2:13:11,Service process what I um have discovered is that in a when they're,https://www.youtube.com/watch?v=ABsfv6bzOBA&ab_channel=NewOrleansCityCouncil
2:13:17,filling out their uh application it doesn't specifically ask about domicile,https://www.youtube.com/watch?v=ABsfv6bzOBA&ab_channel=NewOrleansCityCouncil
2:13:23,as in it indicates that you have to be domiciled in New Orleans but many people make the register outside of New Orleans,https://www.youtube.com/watch?v=ABsfv6bzOBA&ab_channel=NewOrleansCityCouncil
2:13:31,um as well and so they go through the entire interview process and when they,https://www.youtube.com/watch?v=ABsfv6bzOBA&ab_channel=NewOrleansCityCouncil
2:13:36,come in that's when we have to um make them aware that although you,https://www.youtube.com/watch?v=ABsfv6bzOBA&ab_channel=NewOrleansCityCouncil
2:13:41,made the register and you're a candidate for employment here there's a domicile,https://www.youtube.com/watch?v=ABsfv6bzOBA&ab_channel=NewOrleansCityCouncil
2:13:47,requirement and so I think that is I can't give you a specific number but,https://www.youtube.com/watch?v=ABsfv6bzOBA&ab_channel=NewOrleansCityCouncil
2:13:53,many applicants on the register um aren't domiciled in New Orleans but,https://www.youtube.com/watch?v=ABsfv6bzOBA&ab_channel=NewOrleansCityCouncil
2:13:58,they still make the register as an applicant and then we schedule interviews what I like to up is that,https://www.youtube.com/watch?v=ABsfv6bzOBA&ab_channel=NewOrleansCityCouncil
2:14:05,I'll just say Juvenile Detention counselor one there were 33 applicants I,https://www.youtube.com/watch?v=ABsfv6bzOBA&ab_channel=NewOrleansCityCouncil
2:14:11,offered 23 interviews only five accepted and showed up and we hired two out of,https://www.youtube.com/watch?v=ABsfv6bzOBA&ab_channel=NewOrleansCityCouncil
2:14:17,that one was from New Orleans and one had to file for Adama style exemption,https://www.youtube.com/watch?v=ABsfv6bzOBA&ab_channel=NewOrleansCityCouncil
2:14:22,because they weren't domiciled in New Orleans okay that's that's helpful what about AMD do we have any sense EMD as it,https://www.youtube.com/watch?v=ABsfv6bzOBA&ab_channel=NewOrleansCityCouncil
2:14:28,stands now 18 of the 22 mechanic currently live outside the surrounding Parish so once they get through the process we have to determine whether or,https://www.youtube.com/watch?v=ABsfv6bzOBA&ab_channel=NewOrleansCityCouncil
2:14:36,not they live here and then uh as it stands now we have to tell them that there is uh the requirement to live,https://www.youtube.com/watch?v=ABsfv6bzOBA&ab_channel=NewOrleansCityCouncil
2:14:41,within the city but we can't offer them an exemption this Dom is our way but we'll relieve that of the responsibility,https://www.youtube.com/watch?v=ABsfv6bzOBA&ab_channel=NewOrleansCityCouncil
2:14:48,right now so it sounds like you have a pool of about 18 who you can go back after this has passed no 18 of the 22,https://www.youtube.com/watch?v=ABsfv6bzOBA&ab_channel=NewOrleansCityCouncil
2:14:53,currently working outside of the parish I see I see um for EMD,https://www.youtube.com/watch?v=ABsfv6bzOBA&ab_channel=NewOrleansCityCouncil
2:14:59,um are we doing any contract work like meaning not on site we work into that,https://www.youtube.com/watch?v=ABsfv6bzOBA&ab_channel=NewOrleansCityCouncil
2:15:06,process now to the moment process where if we have like alternator or something small that we can contract out with some,https://www.youtube.com/watch?v=ABsfv6bzOBA&ab_channel=NewOrleansCityCouncil
2:15:12,of the smaller agencies and get that paid through be working through that process now so we don't have to go,https://www.youtube.com/watch?v=ABsfv6bzOBA&ab_channel=NewOrleansCityCouncil
2:15:17,through the uh through the major companies like take it to one of the bigger dealers we're,https://www.youtube.com/watch?v=ABsfv6bzOBA&ab_channel=NewOrleansCityCouncil
2:15:23,trying to work out how we can pay them if we have like a generate I mean not a generator alternator something small but,https://www.youtube.com/watch?v=ABsfv6bzOBA&ab_channel=NewOrleansCityCouncil
2:15:29,you're trying to figure out how to pay pay that out so we can get the vehicles back up and running yeah I mean I think it's important we know how many vehicles,https://www.youtube.com/watch?v=ABsfv6bzOBA&ab_channel=NewOrleansCityCouncil
2:15:36,are just sitting there that need tow trucks for example I think we have two um most of it is supply issues,https://www.youtube.com/watch?v=ABsfv6bzOBA&ab_channel=NewOrleansCityCouncil
2:15:43,just trying to get parts so it but if you could contract with the mom and pop or outside they might have the parts is,https://www.youtube.com/watch?v=ABsfv6bzOBA&ab_channel=NewOrleansCityCouncil
2:15:50,that the issue or are you just a lot of them can get it from Amazon and stuff like that and they may have Parts if,https://www.youtube.com/watch?v=ABsfv6bzOBA&ab_channel=NewOrleansCityCouncil
2:15:55,we're able to get it to a mom and pop shop it's just no matter how we're going to get them paid okay it's a procurement,https://www.youtube.com/watch?v=ABsfv6bzOBA&ab_channel=NewOrleansCityCouncil
2:16:01,issue yes okay and we worked with normal white to get that worked out all right,https://www.youtube.com/watch?v=ABsfv6bzOBA&ab_channel=NewOrleansCityCouncil
2:16:06,thanks council member King questions for this uh Williams first of,https://www.youtube.com/watch?v=ABsfv6bzOBA&ab_channel=NewOrleansCityCouncil
2:16:12,all congratulations thank you name director,https://www.youtube.com/watch?v=ABsfv6bzOBA&ab_channel=NewOrleansCityCouncil
2:16:17,well I said he got that right over in jjicic my first question is um,https://www.youtube.com/watch?v=ABsfv6bzOBA&ab_channel=NewOrleansCityCouncil
2:16:23,how many what's up roughly the percentage of workers in jjic are not,https://www.youtube.com/watch?v=ABsfv6bzOBA&ab_channel=NewOrleansCityCouncil
2:16:28,domiciled in New Orleans approximately um,https://www.youtube.com/watch?v=ABsfv6bzOBA&ab_channel=NewOrleansCityCouncil
2:16:33,12 no percentage oh percentage are not domiciled in New Orleans,https://www.youtube.com/watch?v=ABsfv6bzOBA&ab_channel=NewOrleansCityCouncil
2:16:40,um about I'll see it's a small percentage right now um but I can tell you is that we have,https://www.youtube.com/watch?v=ABsfv6bzOBA&ab_channel=NewOrleansCityCouncil
2:16:48,um 34 employees that are domiciled in New Orleans and approximately maybe,https://www.youtube.com/watch?v=ABsfv6bzOBA&ab_channel=NewOrleansCityCouncil
2:16:54,um 12 to 16 that aren't domiciled in New Orleans okay,https://www.youtube.com/watch?v=ABsfv6bzOBA&ab_channel=NewOrleansCityCouncil
2:17:00,and um how long after 12 that 12 to 16 is not,https://www.youtube.com/watch?v=ABsfv6bzOBA&ab_channel=NewOrleansCityCouncil
2:17:06,domicile how long have they been working in ajicic or at jjicic,https://www.youtube.com/watch?v=ABsfv6bzOBA&ab_channel=NewOrleansCityCouncil
2:17:11,anywhere between five to 12 years,https://www.youtube.com/watch?v=ABsfv6bzOBA&ab_channel=NewOrleansCityCouncil
2:17:19,and and last two questions,https://www.youtube.com/watch?v=ABsfv6bzOBA&ab_channel=NewOrleansCityCouncil
2:17:25,do you think having domicile requirement wave hurts your ability to,https://www.youtube.com/watch?v=ABsfv6bzOBA&ab_channel=NewOrleansCityCouncil
2:17:32,properly run or does it help what does it does it hurt your ability to properly run jjic I think right now,https://www.youtube.com/watch?v=ABsfv6bzOBA&ab_channel=NewOrleansCityCouncil
2:17:39,um it hurts my ability but we need any and every person that wants to,https://www.youtube.com/watch?v=ABsfv6bzOBA&ab_channel=NewOrleansCityCouncil
2:17:45,enhance the quality of life or the population that we serve regardless to where they live if they are willing to,https://www.youtube.com/watch?v=ABsfv6bzOBA&ab_channel=NewOrleansCityCouncil
2:17:52,deposit great things into the city's most vulnerable youth they can live in Timbuktu if they can do,https://www.youtube.com/watch?v=ABsfv6bzOBA&ab_channel=NewOrleansCityCouncil
2:18:00,the work from Timbuktu we would like to have those people it's about uh just,https://www.youtube.com/watch?v=ABsfv6bzOBA&ab_channel=NewOrleansCityCouncil
2:18:06,making sure that we are doing everything in our power to help,https://www.youtube.com/watch?v=ABsfv6bzOBA&ab_channel=NewOrleansCityCouncil
2:18:11,fix this crisis that we're in all right and you're you are currently hiring right now we're hiring every day Monday,https://www.youtube.com/watch?v=ABsfv6bzOBA&ab_channel=NewOrleansCityCouncil
2:18:19,Wednesdays and Fridays we take walk-ins we do scheduled interviews um we're hiring we're advocating uh,https://www.youtube.com/watch?v=ABsfv6bzOBA&ab_channel=NewOrleansCityCouncil
2:18:27,myself and my team in grocery stores and drive-throughs and restaurants we are,https://www.youtube.com/watch?v=ABsfv6bzOBA&ab_channel=NewOrleansCityCouncil
2:18:33,hiring for all positions Juvenile Detention counselors we have some administrative positions available we,https://www.youtube.com/watch?v=ABsfv6bzOBA&ab_channel=NewOrleansCityCouncil
2:18:39,are hiring for grounds Patrol laborers uh Food Service workers Social Service,https://www.youtube.com/watch?v=ABsfv6bzOBA&ab_channel=NewOrleansCityCouncil
2:18:44,workers and why so are you involved on this new task force created by the administration,https://www.youtube.com/watch?v=ABsfv6bzOBA&ab_channel=NewOrleansCityCouncil
2:18:51,no for you well um if acts to be involved would you have,https://www.youtube.com/watch?v=ABsfv6bzOBA&ab_channel=NewOrleansCityCouncil
2:18:58,a problem with joining the task force you connected as I've heard um brother hi Kim speak and um Miss pradesha speak,https://www.youtube.com/watch?v=ABsfv6bzOBA&ab_channel=NewOrleansCityCouncil
2:19:07,um well connected to the parents um I pretty much what we're seeing are,https://www.youtube.com/watch?v=ABsfv6bzOBA&ab_channel=NewOrleansCityCouncil
2:19:13,the siblings of past kids that have been system involved at jjicic and so I'm,https://www.youtube.com/watch?v=ABsfv6bzOBA&ab_channel=NewOrleansCityCouncil
2:19:20,um connected to those families very closely as well Patrol one of the reasons selection was,https://www.youtube.com/watch?v=ABsfv6bzOBA&ab_channel=NewOrleansCityCouncil
2:19:26,kind of selective was because of sensitive information about children,https://www.youtube.com/watch?v=ABsfv6bzOBA&ab_channel=NewOrleansCityCouncil
2:19:31,possibly being exposed and I don't know how more sensitive information would be basically,https://www.youtube.com/watch?v=ABsfv6bzOBA&ab_channel=NewOrleansCityCouncil
2:19:38,you around children all day you know all the information already so how can you be how can you be exposed to more,https://www.youtube.com/watch?v=ABsfv6bzOBA&ab_channel=NewOrleansCityCouncil
2:19:44,sensitive information that's one of the reasons why we were told certain people were not a part of the the task force so,https://www.youtube.com/watch?v=ABsfv6bzOBA&ab_channel=NewOrleansCityCouncil
2:19:51,again to those people listening I think that you whether I came spoke earlier are two integral Parts uh of the,https://www.youtube.com/watch?v=ABsfv6bzOBA&ab_channel=NewOrleansCityCouncil
2:19:58,community that's not a part of this task force and if you are bought on it can,https://www.youtube.com/watch?v=ABsfv6bzOBA&ab_channel=NewOrleansCityCouncil
2:20:03,add value to to the task force and help reduce the crime in the city I agree and I am,https://www.youtube.com/watch?v=ABsfv6bzOBA&ab_channel=NewOrleansCityCouncil
2:20:09,pretty much the keeper of that confidential information council member King I am a part of that,https://www.youtube.com/watch?v=ABsfv6bzOBA&ab_channel=NewOrleansCityCouncil
2:20:15,violent crime task force and it did have some questions about uh juvenile center and I was going to get with uh Miss,https://www.youtube.com/watch?v=ABsfv6bzOBA&ab_channel=NewOrleansCityCouncil
2:20:22,Williams and I'll definitely bring everything back to her but I am a part of that task force you're the,https://www.youtube.com/watch?v=ABsfv6bzOBA&ab_channel=NewOrleansCityCouncil
2:20:28,decision-making person to put it together no sir I just messaged you thank you,https://www.youtube.com/watch?v=ABsfv6bzOBA&ab_channel=NewOrleansCityCouncil
2:20:34,that's it that's all about it councilman that's it council member came,https://www.youtube.com/watch?v=ABsfv6bzOBA&ab_channel=NewOrleansCityCouncil
2:20:41,no I think councilmember green no no I was just asking if you had any questions I was going to call the question,https://www.youtube.com/watch?v=ABsfv6bzOBA&ab_channel=NewOrleansCityCouncil
2:20:47,for the member well I don't know that you're not an official member no no that's what I'm saying No in fact you're right I was going to ask one of you all,https://www.youtube.com/watch?v=ABsfv6bzOBA&ab_channel=NewOrleansCityCouncil
2:20:54,to move to approve right but wait the only reason I said like that I don't know if they're any online,https://www.youtube.com/watch?v=ABsfv6bzOBA&ab_channel=NewOrleansCityCouncil
2:21:01,don't give me that option I already addressed your son's status,https://www.youtube.com/watch?v=ABsfv6bzOBA&ab_channel=NewOrleansCityCouncil
2:21:06,exactly uh yeah uh move move to uh for the committee to adopt the ordinance,https://www.youtube.com/watch?v=ABsfv6bzOBA&ab_channel=NewOrleansCityCouncil
2:21:14,it moved by council member Kings second by council member Harris Fortune,https://www.youtube.com/watch?v=ABsfv6bzOBA&ab_channel=NewOrleansCityCouncil
2:21:19,machines four years no days it's adopted thank you council member,https://www.youtube.com/watch?v=ABsfv6bzOBA&ab_channel=NewOrleansCityCouncil
2:21:24,thank you thank you councilmember Thomas councilman green I'm sorry Harris councilman Morrell councilman McCain,https://www.youtube.com/watch?v=ABsfv6bzOBA&ab_channel=NewOrleansCityCouncil
2:21:30,thank you all so much we really appreciate this just want y'all to know that we are working hard and diligently,https://www.youtube.com/watch?v=ABsfv6bzOBA&ab_channel=NewOrleansCityCouncil
2:21:35,trying to get these people hired up and uh we appreciate everything y'all do for us thank you all so much thank you of,https://www.youtube.com/watch?v=ABsfv6bzOBA&ab_channel=NewOrleansCityCouncil
2:21:41,course thank you Mr chair may I request that a member of this committee move to,https://www.youtube.com/watch?v=ABsfv6bzOBA&ab_channel=NewOrleansCityCouncil
2:21:47,approve it on to include it on the consent agenda yeah yeah yeah okay yeah,https://www.youtube.com/watch?v=ABsfv6bzOBA&ab_channel=NewOrleansCityCouncil
2:21:56,yeah everybody was in favor so I think you're good then,https://www.youtube.com/watch?v=ABsfv6bzOBA&ab_channel=NewOrleansCityCouncil
2:22:04,I don't want to hear it we know you missed the human resource yeah next item,https://www.youtube.com/watch?v=ABsfv6bzOBA&ab_channel=NewOrleansCityCouncil
2:22:09,on the agenda today councilmember we have an amendment that we need to um suspend the rules to the agenda,https://www.youtube.com/watch?v=ABsfv6bzOBA&ab_channel=NewOrleansCityCouncil
2:22:16,any online comments about that uh not for this no okay not yet no,https://www.youtube.com/watch?v=ABsfv6bzOBA&ab_channel=NewOrleansCityCouncil
2:22:21,there's one later all right so um we have a motion to suspend the rules,https://www.youtube.com/watch?v=ABsfv6bzOBA&ab_channel=NewOrleansCityCouncil
2:22:27,don't move a second I lost one I lost my quorum,https://www.youtube.com/watch?v=ABsfv6bzOBA&ab_channel=NewOrleansCityCouncil
2:22:38,move to suspend the rules second but second about councilmember Morrell all,https://www.youtube.com/watch?v=ABsfv6bzOBA&ab_channel=NewOrleansCityCouncil
2:22:43,in favor three days no days the rules are suspended Miss current bye-bye guys,https://www.youtube.com/watch?v=ABsfv6bzOBA&ab_channel=NewOrleansCityCouncil
2:22:49,thank y'all we have a um Amendment two ordinance calendar number thirty,https://www.youtube.com/watch?v=ABsfv6bzOBA&ab_channel=NewOrleansCityCouncil
2:22:55,four thousand three foreign Department of Code Enforcement as a,https://www.youtube.com/watch?v=ABsfv6bzOBA&ab_channel=NewOrleansCityCouncil
2:23:02,governing department for enforcement of vehicle impoundment or illegal dumping with the Department,https://www.youtube.com/watch?v=ABsfv6bzOBA&ab_channel=NewOrleansCityCouncil
2:23:07,of Safety and permits is this councilmember greens also,https://www.youtube.com/watch?v=ABsfv6bzOBA&ab_channel=NewOrleansCityCouncil
2:23:14,yes council member green the committee will recognize you thank you very much I,https://www.youtube.com/watch?v=ABsfv6bzOBA&ab_channel=NewOrleansCityCouncil
2:23:20,appreciate that council members this amendment simply um addresses a change that,https://www.youtube.com/watch?v=ABsfv6bzOBA&ab_channel=NewOrleansCityCouncil
2:23:27,needs to be made if we're going to actually enforce the,https://www.youtube.com/watch?v=ABsfv6bzOBA&ab_channel=NewOrleansCityCouncil
