Timestamp,Text,url
32:24:00,be a part of it thank you thank you thank you councilmember Moreno council member Thomas uh first of all thank you guys I think,https://www.youtube.com/watch?v=BdORXbpqGVI&ab_channel=NewOrleansCityCouncil
32:31:00,it's a really uh a great thing for the public to hear this uh as much as we,https://www.youtube.com/watch?v=BdORXbpqGVI&ab_channel=NewOrleansCityCouncil
32:37:00,want to rush and start our holidays I don't know if a lot of people understood the detail and the importance uh here uh,https://www.youtube.com/watch?v=BdORXbpqGVI&ab_channel=NewOrleansCityCouncil
32:44:00,for Mr Chase and the other gentleman uh it's good to see uh one of our older more established African-American,https://www.youtube.com/watch?v=BdORXbpqGVI&ab_channel=NewOrleansCityCouncil
32:50:00,families uh be involved in one of the most Otis an established African-American,https://www.youtube.com/watch?v=BdORXbpqGVI&ab_channel=NewOrleansCityCouncil
32:56:00,communities Treme with something that should have been done a long time ago,https://www.youtube.com/watch?v=BdORXbpqGVI&ab_channel=NewOrleansCityCouncil
33:01:00,and thank you guys and bless you guys for finally being part to making sure that happens and is sustainable uh,https://www.youtube.com/watch?v=BdORXbpqGVI&ab_channel=NewOrleansCityCouncil
33:08:00,you're not only credit to your family uh but your credit to the legacy of what they always stood for and that is making,https://www.youtube.com/watch?v=BdORXbpqGVI&ab_channel=NewOrleansCityCouncil
33:15:00,sure that everybody else was okay and that our community understood its history and I think that gets gives,https://www.youtube.com/watch?v=BdORXbpqGVI&ab_channel=NewOrleansCityCouncil
33:20:00,credibility here for the Preservation Hall uh from my relatives uh placed in Justin Adams,https://www.youtube.com/watch?v=BdORXbpqGVI&ab_channel=NewOrleansCityCouncil
33:28:00,my cousin Walter Harris uh Walter,https://www.youtube.com/watch?v=BdORXbpqGVI&ab_channel=NewOrleansCityCouncil
33:34:00,has talked to us about the importance of investing in Preservation Hall and I,https://www.youtube.com/watch?v=BdORXbpqGVI&ab_channel=NewOrleansCityCouncil
33:41:00,don't know there's so many people around the world I'm lucky enough to be related,https://www.youtube.com/watch?v=BdORXbpqGVI&ab_channel=NewOrleansCityCouncil
33:46:00,to some family members who support who performed there and where they can talk,https://www.youtube.com/watch?v=BdORXbpqGVI&ab_channel=NewOrleansCityCouncil
33:51:00,to us but I don't know that the rest of our community understands the role like preservation all plays,https://www.youtube.com/watch?v=BdORXbpqGVI&ab_channel=NewOrleansCityCouncil
33:58:00,in the tourism industry and the culture in the music industry so uh Walter would,https://www.youtube.com/watch?v=BdORXbpqGVI&ab_channel=NewOrleansCityCouncil
34:04:00,tell me he's not going to congratulate me when we get together he's going to say we should have did this a long time,https://www.youtube.com/watch?v=BdORXbpqGVI&ab_channel=NewOrleansCityCouncil
34:11:00,ago uh so it's it's an honor to be able to participate in continuing that Legacy,https://www.youtube.com/watch?v=BdORXbpqGVI&ab_channel=NewOrleansCityCouncil
34:16:00,uh be the second line get lit stay lit uh join Ida uh Howie would tell,https://www.youtube.com/watch?v=BdORXbpqGVI&ab_channel=NewOrleansCityCouncil
34:25:00,you that for those of us uh who are up on roofs are providing shout out to the,https://www.youtube.com/watch?v=BdORXbpqGVI&ab_channel=NewOrleansCityCouncil
34:32:00,people uh we we would go from our extended parts of the community to go,https://www.youtube.com/watch?v=BdORXbpqGVI&ab_channel=NewOrleansCityCouncil
34:38:00,get fed to go get refueled to go back,https://www.youtube.com/watch?v=BdORXbpqGVI&ab_channel=NewOrleansCityCouncil
34:43:00,in the community and while we were doing that we just couldn't understand why some of us had,https://www.youtube.com/watch?v=BdORXbpqGVI&ab_channel=NewOrleansCityCouncil
34:49:00,to travel a long ways from the edges of the edges of this city uh to be able to do that to go get,https://www.youtube.com/watch?v=BdORXbpqGVI&ab_channel=NewOrleansCityCouncil
34:55:00,something to eat we couldn't find it out in the outer parts of the East we couldn't find it in the outer parts of,https://www.youtube.com/watch?v=BdORXbpqGVI&ab_channel=NewOrleansCityCouncil
35:02:00,the area and I remember being on a roof uh off of Reed where here my old butt,https://www.youtube.com/watch?v=BdORXbpqGVI&ab_channel=NewOrleansCityCouncil
35:09:00,was up on the roof uh trying to help a lady protect their house right and I had,https://www.youtube.com/watch?v=BdORXbpqGVI&ab_channel=NewOrleansCityCouncil
35:16:00,not eaten I I had nothing there to sustained,https://www.youtube.com/watch?v=BdORXbpqGVI&ab_channel=NewOrleansCityCouncil
35:21:00,myself she had nothing in her home and we had to go to the food line that y'all,https://www.youtube.com/watch?v=BdORXbpqGVI&ab_channel=NewOrleansCityCouncil
35:27:00,had put together and drive into town to get some food in and the the,https://www.youtube.com/watch?v=BdORXbpqGVI&ab_channel=NewOrleansCityCouncil
35:32:00,importance of that because I experienced it was that gave me what I needed to sustain,https://www.youtube.com/watch?v=BdORXbpqGVI&ab_channel=NewOrleansCityCouncil
35:38:00,myself to go back to help her finish putting that top on her roof so while we hadn't,https://www.youtube.com/watch?v=BdORXbpqGVI&ab_channel=NewOrleansCityCouncil
35:45:00,done that a long time ago Howie young lady thank you guys,https://www.youtube.com/watch?v=BdORXbpqGVI&ab_channel=NewOrleansCityCouncil
35:50:00,to know that this should be easy right you would have had to have been there to understand that how we would go eat,https://www.youtube.com/watch?v=BdORXbpqGVI&ab_channel=NewOrleansCityCouncil
35:57:00,go back to work uh the North Peace I don't know,https://www.youtube.com/watch?v=BdORXbpqGVI&ab_channel=NewOrleansCityCouncil
36:03:00,the young women who were here but to know Malachi uh is unbelievable,https://www.youtube.com/watch?v=BdORXbpqGVI&ab_channel=NewOrleansCityCouncil
36:10:00,in in how he represents those young people and how he represents young black men,https://www.youtube.com/watch?v=BdORXbpqGVI&ab_channel=NewOrleansCityCouncil
36:16:00,who have a bad stereotype and how he he represents in many cases young black children,https://www.youtube.com/watch?v=BdORXbpqGVI&ab_channel=NewOrleansCityCouncil
36:22:00,but he is always talking about his peers is always uplifting his community in,https://www.youtube.com/watch?v=BdORXbpqGVI&ab_channel=NewOrleansCityCouncil
36:29:00,spite of the stereotypes so for the young women I know you guys are also equal to the,https://www.youtube.com/watch?v=BdORXbpqGVI&ab_channel=NewOrleansCityCouncil
36:36:00,work but I watched this this young man said hey hold on a second not only What About Us,https://www.youtube.com/watch?v=BdORXbpqGVI&ab_channel=NewOrleansCityCouncil
36:42:00,but less include us and uh the executive parent,https://www.youtube.com/watch?v=BdORXbpqGVI&ab_channel=NewOrleansCityCouncil
36:47:00,every time we out there uh on the lawn or out there with our Outreach initiative where you've worked to get,https://www.youtube.com/watch?v=BdORXbpqGVI&ab_channel=NewOrleansCityCouncil
36:54:00,the hospital and you got a system involved uh and every time I've been,https://www.youtube.com/watch?v=BdORXbpqGVI&ab_channel=NewOrleansCityCouncil
37:00:00,there and most folk know because life is public I've been there with family members,https://www.youtube.com/watch?v=BdORXbpqGVI&ab_channel=NewOrleansCityCouncil
37:06:00,who's that trauma unit saved their lives,https://www.youtube.com/watch?v=BdORXbpqGVI&ab_channel=NewOrleansCityCouncil
37:12:00,we know and the last time I was there,https://www.youtube.com/watch?v=BdORXbpqGVI&ab_channel=NewOrleansCityCouncil
37:19:00,couldn't save their life but we know that violence Interruption,https://www.youtube.com/watch?v=BdORXbpqGVI&ab_channel=NewOrleansCityCouncil
37:26:00,happens too often there in that emergency room at,https://www.youtube.com/watch?v=BdORXbpqGVI&ab_channel=NewOrleansCityCouncil
37:31:00,Emergency Center the work that has to happen so that there's not retaliation,https://www.youtube.com/watch?v=BdORXbpqGVI&ab_channel=NewOrleansCityCouncil
37:38:00,the work that has to happen so that more people don't lose their lives so we really have a collection here,https://www.youtube.com/watch?v=BdORXbpqGVI&ab_channel=NewOrleansCityCouncil
37:45:00,a stuff that needs to be done but should have been done thank y'all,https://www.youtube.com/watch?v=BdORXbpqGVI&ab_channel=NewOrleansCityCouncil
37:52:00,thank you council member Thomas council member Morrell president Morrell thank,https://www.youtube.com/watch?v=BdORXbpqGVI&ab_channel=NewOrleansCityCouncil
37:57:00,you um I want to begin by saying thank you everyone for being here I appreciate,https://www.youtube.com/watch?v=BdORXbpqGVI&ab_channel=NewOrleansCityCouncil
38:03:00,y'all giving us kind of a briefing on how the money is going to be spent I think it's very important not just for us but for the public to be aware of,https://www.youtube.com/watch?v=BdORXbpqGVI&ab_channel=NewOrleansCityCouncil
38:09:00,kind of the good things that could happen with this sort of money I think I'd be remiss in saying,https://www.youtube.com/watch?v=BdORXbpqGVI&ab_channel=NewOrleansCityCouncil
38:15:00,this was not today wasn't difficult correct I mean we're not scary we're not biting anybody up here or anything right,https://www.youtube.com/watch?v=BdORXbpqGVI&ab_channel=NewOrleansCityCouncil
38:20:00,not today anyway not today anyway um I think it would be important to note,https://www.youtube.com/watch?v=BdORXbpqGVI&ab_channel=NewOrleansCityCouncil
38:25:00,that this is how Wisner money is supposed to be given out in a transparent public process with the,https://www.youtube.com/watch?v=BdORXbpqGVI&ab_channel=NewOrleansCityCouncil
38:34:00,council's involvement um this is why the councils in litigation across the street right now,https://www.youtube.com/watch?v=BdORXbpqGVI&ab_channel=NewOrleansCityCouncil
38:40:00,because if we're going to have money that is given to us for a public purpose,https://www.youtube.com/watch?v=BdORXbpqGVI&ab_channel=NewOrleansCityCouncil
38:46:00,it has to be discussed publicly and we all have to own how it's spent,https://www.youtube.com/watch?v=BdORXbpqGVI&ab_channel=NewOrleansCityCouncil
38:51:00,and my hope is when all this is resolved and the City,https://www.youtube.com/watch?v=BdORXbpqGVI&ab_channel=NewOrleansCityCouncil
38:56:00,gets full access to all the money as we should have will have even more money,https://www.youtube.com/watch?v=BdORXbpqGVI&ab_channel=NewOrleansCityCouncil
39:01:00,for programs like this because this is long overdue,https://www.youtube.com/watch?v=BdORXbpqGVI&ab_channel=NewOrleansCityCouncil
39:06:00,um we have a Supreme Court decision from 2014 saying the trust should have ended,https://www.youtube.com/watch?v=BdORXbpqGVI&ab_channel=NewOrleansCityCouncil
39:12:00,and all of these assets should be the cities and if we're successful over there we'll be able to fund so many,https://www.youtube.com/watch?v=BdORXbpqGVI&ab_channel=NewOrleansCityCouncil
39:18:00,other initiatives that are important in the city like the ones before us today because every dollar that we're,https://www.youtube.com/watch?v=BdORXbpqGVI&ab_channel=NewOrleansCityCouncil
39:24:00,allocating today is going to a worthy cause to promote the culture and the future and the young people of the City,https://www.youtube.com/watch?v=BdORXbpqGVI&ab_channel=NewOrleansCityCouncil
39:31:00,of New Orleans and that is what Mr Wisner intended when he originally,https://www.youtube.com/watch?v=BdORXbpqGVI&ab_channel=NewOrleansCityCouncil
39:37:00,created the trust and that is what this council is committed to doing so thank,https://www.youtube.com/watch?v=BdORXbpqGVI&ab_channel=NewOrleansCityCouncil
39:42:00,you all for being here today thank you for answering all of our questions you guys have been very thorough and I appreciate you all stepping up,https://www.youtube.com/watch?v=BdORXbpqGVI&ab_channel=NewOrleansCityCouncil
39:48:00,to preserve our culture to promote our young people or generally to save our lives,https://www.youtube.com/watch?v=BdORXbpqGVI&ab_channel=NewOrleansCityCouncil
39:55:00,so thank you thank you councilmember Morrell council member King I want to thank the young people for,https://www.youtube.com/watch?v=BdORXbpqGVI&ab_channel=NewOrleansCityCouncil
40:02:00,coming today I appreciate the hall work you all are doing it's not every day we we hear about positive and see positive,https://www.youtube.com/watch?v=BdORXbpqGVI&ab_channel=NewOrleansCityCouncil
40:09:00,young people I know speaking in public is not a easy task it's not an easy test,https://www.youtube.com/watch?v=BdORXbpqGVI&ab_channel=NewOrleansCityCouncil
40:15:00,which you all did a great job so congratulations keep up the good work thank you councilmember King,https://www.youtube.com/watch?v=BdORXbpqGVI&ab_channel=NewOrleansCityCouncil
40:21:00,councilmember jeruso yeah I just want to say thank you all for being here today and to Echo what president Morrell said,https://www.youtube.com/watch?v=BdORXbpqGVI&ab_channel=NewOrleansCityCouncil
40:27:00,which is this is a great process to be able to discuss everything I think there's a difference too between,https://www.youtube.com/watch?v=BdORXbpqGVI&ab_channel=NewOrleansCityCouncil
40:32:00,allocating money to faceless things that you know may happen and you've personalized both with the young people,https://www.youtube.com/watch?v=BdORXbpqGVI&ab_channel=NewOrleansCityCouncil
40:40:00,who've been here today and the people who've been at this table as well and then you know the other piece for me too,https://www.youtube.com/watch?v=BdORXbpqGVI&ab_channel=NewOrleansCityCouncil
40:45:00,is this is where allocation intersects with need,https://www.youtube.com/watch?v=BdORXbpqGVI&ab_channel=NewOrleansCityCouncil
40:51:00,um that's the other part that's so important we have so many needs in our city whether it's Nord whether it's,https://www.youtube.com/watch?v=BdORXbpqGVI&ab_channel=NewOrleansCityCouncil
40:57:00,violence and eruption whether it's resiliency and sustainability whether it's places like Preservation hall or,https://www.youtube.com/watch?v=BdORXbpqGVI&ab_channel=NewOrleansCityCouncil
41:03:00,the African-American Museum we have other places that are very well funded and and they don't need as much,https://www.youtube.com/watch?v=BdORXbpqGVI&ab_channel=NewOrleansCityCouncil
41:09:00,attention and they can rely on their funding to do the things that they're doing so I think this is something that,https://www.youtube.com/watch?v=BdORXbpqGVI&ab_channel=NewOrleansCityCouncil
41:15:00,makes it also exciting for us is that um knowing that these needs exist and,https://www.youtube.com/watch?v=BdORXbpqGVI&ab_channel=NewOrleansCityCouncil
41:20:00,and the fact not only you've answered all these questions but personalizing,https://www.youtube.com/watch?v=BdORXbpqGVI&ab_channel=NewOrleansCityCouncil
41:26:00,these things and emphasizing the importance I think it's important to us as a group so thank you for all your time particularly,https://www.youtube.com/watch?v=BdORXbpqGVI&ab_channel=NewOrleansCityCouncil
41:32:00,um on a holiday we appreciate it thank you council member jeruso we have one speaker's card,https://www.youtube.com/watch?v=BdORXbpqGVI&ab_channel=NewOrleansCityCouncil
41:39:00,Mr Michael Burnside Harris,https://www.youtube.com/watch?v=BdORXbpqGVI&ab_channel=NewOrleansCityCouncil
41:49:00,Michael Burnside 2215 Felicity and several things here staggered me today but to know that I'm the only one with a,https://www.youtube.com/watch?v=BdORXbpqGVI&ab_channel=NewOrleansCityCouncil
41:55:00,speaker's card from the public is probably the most staggering thing you think there would be more people out here saying good things to good people,https://www.youtube.com/watch?v=BdORXbpqGVI&ab_channel=NewOrleansCityCouncil
42:01:00,for doing good work we don't often get to say good things my mind also shifts to bad things which,https://www.youtube.com/watch?v=BdORXbpqGVI&ab_channel=NewOrleansCityCouncil
42:08:00,is unfortunate because it says something about me that's a little bit scary I think about affordable housing and,https://www.youtube.com/watch?v=BdORXbpqGVI&ab_channel=NewOrleansCityCouncil
42:14:00,when I hear Sticks and Bricks I think of 24-hour life 24-hour life seven days a week,https://www.youtube.com/watch?v=BdORXbpqGVI&ab_channel=NewOrleansCityCouncil
42:20:00,so places that put Up Sticks and Bricks from my point of view whether they're churches or non-profits or city,https://www.youtube.com/watch?v=BdORXbpqGVI&ab_channel=NewOrleansCityCouncil
42:25:00,buildings really don't have the right to remain empty 24 7 on a Saturday or 12 hours on,https://www.youtube.com/watch?v=BdORXbpqGVI&ab_channel=NewOrleansCityCouncil
42:34:00,a Monday not when we got people living under a bridge so even if you can only house one guy,https://www.youtube.com/watch?v=BdORXbpqGVI&ab_channel=NewOrleansCityCouncil
42:39:00,and even if he's just your janitor even if he's not really your security guy your security is actually really,https://www.youtube.com/watch?v=BdORXbpqGVI&ab_channel=NewOrleansCityCouncil
42:46:00,electronic and you hire a security team to come in a pickup truck and solve your problems even if it's just your,https://www.youtube.com/watch?v=BdORXbpqGVI&ab_channel=NewOrleansCityCouncil
42:52:00,third cousin who needs a place to stay I'm less against nepotism than maybe you think I am,https://www.youtube.com/watch?v=BdORXbpqGVI&ab_channel=NewOrleansCityCouncil
42:58:00,um people need a place to stay and they need to be part of a culture when they stay in it and so as you build things out of Sticks,https://www.youtube.com/watch?v=BdORXbpqGVI&ab_channel=NewOrleansCityCouncil
43:05:00,and Bricks uh do more than hire people do more than pay them a paycheck because a lot of,https://www.youtube.com/watch?v=BdORXbpqGVI&ab_channel=NewOrleansCityCouncil
43:10:00,people don't use their paycheck wisely they're people under the bridge that use their paychecks they get paychecks they,https://www.youtube.com/watch?v=BdORXbpqGVI&ab_channel=NewOrleansCityCouncil
43:15:00,use them for heroin so rather than pay people for cash money that they then use however they want,https://www.youtube.com/watch?v=BdORXbpqGVI&ab_channel=NewOrleansCityCouncil
43:21:00,this is a bitter thing to say in the South and I probably shouldn't say it but I'll say it anyway enslave them a,https://www.youtube.com/watch?v=BdORXbpqGVI&ab_channel=NewOrleansCityCouncil
43:27:00,little bit give them a house I come out of a West Virginia Hill culture where we had company stores and where we had,https://www.youtube.com/watch?v=BdORXbpqGVI&ab_channel=NewOrleansCityCouncil
43:32:00,script and it can be evil there's no doubt it can be evil it doesn't mean it has to be,https://www.youtube.com/watch?v=BdORXbpqGVI&ab_channel=NewOrleansCityCouncil
43:38:00,you care about people and you love them and you're a church somebody should be in your building thank you thank you Mr,https://www.youtube.com/watch?v=BdORXbpqGVI&ab_channel=NewOrleansCityCouncil
43:44:00,Burnside do we have any online comments we do not,https://www.youtube.com/watch?v=BdORXbpqGVI&ab_channel=NewOrleansCityCouncil
43:49:00,the Edward Wisner Foundation or donation was created over 100 years ago to fund,https://www.youtube.com/watch?v=BdORXbpqGVI&ab_channel=NewOrleansCityCouncil
43:55:00,public and non-profit organizations and activities that enhance the quality of life in our city,https://www.youtube.com/watch?v=BdORXbpqGVI&ab_channel=NewOrleansCityCouncil
44:02:00,today's hearing was an opportunity for the public to hear from applicants and also recommendations of the,https://www.youtube.com/watch?v=BdORXbpqGVI&ab_channel=NewOrleansCityCouncil
44:08:00,administration we look forward to if this resolution passes to working with you all to continue to do the work that,https://www.youtube.com/watch?v=BdORXbpqGVI&ab_channel=NewOrleansCityCouncil
44:15:00,enhances the quality of life in our city and makes our city very special I have moved for approval on R23 142 it's been,https://www.youtube.com/watch?v=BdORXbpqGVI&ab_channel=NewOrleansCityCouncil
44:25:00,seconded by council member Harris members voucher machine,https://www.youtube.com/watch?v=BdORXbpqGVI&ab_channel=NewOrleansCityCouncil
44:30:00,resolution r23-142 is approved five to no five five,https://www.youtube.com/watch?v=BdORXbpqGVI&ab_channel=NewOrleansCityCouncil
44:37:00,zero and I thank you all for your presentations today and I do want to focus again on our youth thank you all,https://www.youtube.com/watch?v=BdORXbpqGVI&ab_channel=NewOrleansCityCouncil
44:43:00,very much for what you do and I want to say to my fellow council members that now that this is passed notice that I,https://www.youtube.com/watch?v=BdORXbpqGVI&ab_channel=NewOrleansCityCouncil
44:48:00,didn't dwell on the fact that Malachi Williams is a graduate of St Augustine High School I'll just end it with that,https://www.youtube.com/watch?v=BdORXbpqGVI&ab_channel=NewOrleansCityCouncil
44:54:00,so proud of his work he's a freshman this one was coming thank you please a,https://www.youtube.com/watch?v=BdORXbpqGVI&ab_channel=NewOrleansCityCouncil
45:01:00,freshman I saw a graduate freshman and please keep us in the loop as to what the activities are and how we can work,https://www.youtube.com/watch?v=BdORXbpqGVI&ab_channel=NewOrleansCityCouncil
45:08:00,together to build on what we've done today thank you thank you so much thank,https://www.youtube.com/watch?v=BdORXbpqGVI&ab_channel=NewOrleansCityCouncil
45:13:00,you so much you're welcome no no yeah,https://www.youtube.com/watch?v=BdORXbpqGVI&ab_channel=NewOrleansCityCouncil
46:01:00,thank you,https://www.youtube.com/watch?v=BdORXbpqGVI&ab_channel=NewOrleansCityCouncil
46:27:00,foreign,https://www.youtube.com/watch?v=BdORXbpqGVI&ab_channel=NewOrleansCityCouncil
47:18:00,thank you,https://www.youtube.com/watch?v=BdORXbpqGVI&ab_channel=NewOrleansCityCouncil
47:52:00,Metallica I know I'll see you again Malachi she is in the hallway though,https://www.youtube.com/watch?v=BdORXbpqGVI&ab_channel=NewOrleansCityCouncil
47:59:00,giving an interview you might be able to catch her,https://www.youtube.com/watch?v=BdORXbpqGVI&ab_channel=NewOrleansCityCouncil
48:59:00,foreign,https://www.youtube.com/watch?v=BdORXbpqGVI&ab_channel=NewOrleansCityCouncil
50:08:00,council members we're now going to start on the consent agenda,https://www.youtube.com/watch?v=BdORXbpqGVI&ab_channel=NewOrleansCityCouncil
50:13:00,yeah we're on top of page four we have a,https://www.youtube.com/watch?v=BdORXbpqGVI&ab_channel=NewOrleansCityCouncil
50:19:00,communication from Aaron Spears chief of staff and Council Council utilities regulatory office this should be marked,https://www.youtube.com/watch?v=BdORXbpqGVI&ab_channel=NewOrleansCityCouncil
50:26:00,received page five we have a communication from Andrew Shepard manager Southern recycling LLC this,https://www.youtube.com/watch?v=BdORXbpqGVI&ab_channel=NewOrleansCityCouncil
50:35:00,should be Mark receive suggested hearing date is may 11. we have a communication from Zachary Smith owner Zach Smith,https://www.youtube.com/watch?v=BdORXbpqGVI&ab_channel=NewOrleansCityCouncil
50:43:00,Consulting 74-65 7467 Pitt Street this should be,https://www.youtube.com/watch?v=BdORXbpqGVI&ab_channel=NewOrleansCityCouncil
50:49:00,Mark receive suggested hearing date April 20th we have a communication from Elizabeth,https://www.youtube.com/watch?v=BdORXbpqGVI&ab_channel=NewOrleansCityCouncil
50:55:00,home director of land use council member Leslie Harris District B,https://www.youtube.com/watch?v=BdORXbpqGVI&ab_channel=NewOrleansCityCouncil
51:01:00,this should be Mark received suggested hearing date is April 20th on top of page six we have a communication from,https://www.youtube.com/watch?v=BdORXbpqGVI&ab_channel=NewOrleansCityCouncil
51:09:00,Darren P Lombard Clerk of criminal District Court chief of Elections officer this should be marked received,https://www.youtube.com/watch?v=BdORXbpqGVI&ab_channel=NewOrleansCityCouncil
51:15:00,we have a communication from Dr Jennifer avegno director Department of Health City of New Orleans this should be,https://www.youtube.com/watch?v=BdORXbpqGVI&ab_channel=NewOrleansCityCouncil
51:22:00,marked receive and referred to the criminal justice committee on top of page seven we have a communication from,https://www.youtube.com/watch?v=BdORXbpqGVI&ab_channel=NewOrleansCityCouncil
51:29:00,Amy trepanying director of personnel City of New Orleans Department of Civil,https://www.youtube.com/watch?v=BdORXbpqGVI&ab_channel=NewOrleansCityCouncil
51:34:00,Service this should be Mark received we have a report of the Department of deputy director of the New Orleans,https://www.youtube.com/watch?v=BdORXbpqGVI&ab_channel=NewOrleansCityCouncil
51:41:00,historic district Landmark commission Central business district,https://www.youtube.com/watch?v=BdORXbpqGVI&ab_channel=NewOrleansCityCouncil
51:47:00,landmarks commissions 1001 Howard Avenue this should be Mark,https://www.youtube.com/watch?v=BdORXbpqGVI&ab_channel=NewOrleansCityCouncil
51:53:00,received we have a report of the director of the vucare commission 1009,https://www.youtube.com/watch?v=BdORXbpqGVI&ab_channel=NewOrleansCityCouncil
51:58:00,burgundy Street this should be Mark received on top of page eight we have a,https://www.youtube.com/watch?v=BdORXbpqGVI&ab_channel=NewOrleansCityCouncil
52:04:00,report of the executive director of the City Planning Commission this should be Mark received suggested,https://www.youtube.com/watch?v=BdORXbpqGVI&ab_channel=NewOrleansCityCouncil
