Timestamp,Text,url
2:45:33,her thank you thank you guys very much we appreciate you thank you very much uh councilmember uh Morrell,https://www.youtube.com/watch?v=PwiJYkLNzZA&ab_channel=NewOrleansCityCouncil
2:45:41,thank you uh Mr chairman I'm seeking to,https://www.youtube.com/watch?v=PwiJYkLNzZA&ab_channel=NewOrleansCityCouncil
2:45:46,do something a little bit out of order um but in order yeah uh we have Jeff,https://www.youtube.com/watch?v=PwiJYkLNzZA&ab_channel=NewOrleansCityCouncil
2:45:52,Asher here who is our Council uh data analyst and I like to call him the table,https://www.youtube.com/watch?v=PwiJYkLNzZA&ab_channel=NewOrleansCityCouncil
2:45:58,just because I do believe there's a component of this,https://www.youtube.com/watch?v=PwiJYkLNzZA&ab_channel=NewOrleansCityCouncil
2:46:04,meeting that in hindsight uh we should have been in,https://www.youtube.com/watch?v=PwiJYkLNzZA&ab_channel=NewOrleansCityCouncil
2:46:09,communication my office and the rest of the offices with the chairman that we should have had to this agenda as many,https://www.youtube.com/watch?v=PwiJYkLNzZA&ab_channel=NewOrleansCityCouncil
2:46:15,of you know the council previously passed a data ordinance that requires,https://www.youtube.com/watch?v=PwiJYkLNzZA&ab_channel=NewOrleansCityCouncil
2:46:21,that all the different criminal justice Partners share data with us in a collaborative way,https://www.youtube.com/watch?v=PwiJYkLNzZA&ab_channel=NewOrleansCityCouncil
2:46:27,so that we could present analysis that data to the public to show the best allocation of resources,https://www.youtube.com/watch?v=PwiJYkLNzZA&ab_channel=NewOrleansCityCouncil
2:46:33,was being done as well as provide information regarding transparency and accountability within,https://www.youtube.com/watch?v=PwiJYkLNzZA&ab_channel=NewOrleansCityCouncil
2:46:40,those said departments and I think it'd be appropriate this time in between our various Partners making presentations,https://www.youtube.com/watch?v=PwiJYkLNzZA&ab_channel=NewOrleansCityCouncil
2:46:47,just to get a very brief report on how that has been going and if all of our,https://www.youtube.com/watch?v=PwiJYkLNzZA&ab_channel=NewOrleansCityCouncil
2:46:53,partners have been collaborating with us pursuant to the ordinance to provide that data for the council for analysis,https://www.youtube.com/watch?v=PwiJYkLNzZA&ab_channel=NewOrleansCityCouncil
2:47:00,so commissioner actually go the table please says,https://www.youtube.com/watch?v=PwiJYkLNzZA&ab_channel=NewOrleansCityCouncil
2:47:11,uh briefly uh can you run down through our various agencies and just,https://www.youtube.com/watch?v=PwiJYkLNzZA&ab_channel=NewOrleansCityCouncil
2:47:18,give us Mr Asher kind of a brief summary on whether or not those agencies have,https://www.youtube.com/watch?v=PwiJYkLNzZA&ab_channel=NewOrleansCityCouncil
2:47:25,been in compliance and what is their degree of compliance I know that typically we consider the nlpd the gold,https://www.youtube.com/watch?v=PwiJYkLNzZA&ab_channel=NewOrleansCityCouncil
2:47:31,standard because they give you direct access to data but I know that what the ordinance is passage we really expanded,https://www.youtube.com/watch?v=PwiJYkLNzZA&ab_channel=NewOrleansCityCouncil
2:47:37,that access to data to a variety of other agencies yeah we absolutely have and good afternoon council members,https://www.youtube.com/watch?v=PwiJYkLNzZA&ab_channel=NewOrleansCityCouncil
2:47:42,pleasure to be in front of you again um we have expanded access over the last,https://www.youtube.com/watch?v=PwiJYkLNzZA&ab_channel=NewOrleansCityCouncil
2:47:47,few months and as you can see on council.noa.gov dashboards the new,https://www.youtube.com/watch?v=PwiJYkLNzZA&ab_channel=NewOrleansCityCouncil
2:47:53,website we have been able to expand the number of dashboards the amount of information that we're then able to push,https://www.youtube.com/watch?v=PwiJYkLNzZA&ab_channel=NewOrleansCityCouncil
2:47:59,to the public it we've also expanded the amount of information that we're able to take,https://www.youtube.com/watch?v=PwiJYkLNzZA&ab_channel=NewOrleansCityCouncil
2:48:05,internally produce anal analysis um and push that out I guess I'll start,https://www.youtube.com/watch?v=PwiJYkLNzZA&ab_channel=NewOrleansCityCouncil
2:48:10,with civil service actually um one of the requests was for data,https://www.youtube.com/watch?v=PwiJYkLNzZA&ab_channel=NewOrleansCityCouncil
2:48:16,access to civil service on things like applications um hiring and other issues of who is,https://www.youtube.com/watch?v=PwiJYkLNzZA&ab_channel=NewOrleansCityCouncil
2:48:23,trying to join nopd both recruits and let new recruits and lateral recruits,https://www.youtube.com/watch?v=PwiJYkLNzZA&ab_channel=NewOrleansCityCouncil
2:48:29,um we're able to produce information like this where we're able to track applications you can see actually we're seeing an uptick in applications over,https://www.youtube.com/watch?v=PwiJYkLNzZA&ab_channel=NewOrleansCityCouncil
2:48:36,the last few months we're able to turn that into analysis which is used in these presentations,https://www.youtube.com/watch?v=PwiJYkLNzZA&ab_channel=NewOrleansCityCouncil
2:48:42,um we are able to track where the applicants are coming from so we can say 65 percent of applicants are coming from,https://www.youtube.com/watch?v=PwiJYkLNzZA&ab_channel=NewOrleansCityCouncil
2:48:48,out of state compared to prior to the announcement 50 um to just throw numbers out there so uh,https://www.youtube.com/watch?v=PwiJYkLNzZA&ab_channel=NewOrleansCityCouncil
2:48:54,very pleased with the information coming from Civil Service uh nopd also very pleased with the data and the,https://www.youtube.com/watch?v=PwiJYkLNzZA&ab_channel=NewOrleansCityCouncil
2:49:01,relationship that we have nopd obviously has a wide variety of data sets that,https://www.youtube.com/watch?v=PwiJYkLNzZA&ab_channel=NewOrleansCityCouncil
2:49:06,they produce in the the already produced publicly specifically 9-1-1 calls for,https://www.youtube.com/watch?v=PwiJYkLNzZA&ab_channel=NewOrleansCityCouncil
2:49:11,service electronic police reports they have uh the other aspect of the police Staffing dashboard is that every week,https://www.youtube.com/watch?v=PwiJYkLNzZA&ab_channel=NewOrleansCityCouncil
2:49:17,they update their numbers so we're able to track over time how many officers,https://www.youtube.com/watch?v=PwiJYkLNzZA&ab_channel=NewOrleansCityCouncil
2:49:22,they have how many recruits they have I believe a recruit class of 19 just started that hasn't quite hit their data,https://www.youtube.com/watch?v=PwiJYkLNzZA&ab_channel=NewOrleansCityCouncil
2:49:28,yet but once it does we'll update it and you'll see a slight uptick in the number of officers and recruits,https://www.youtube.com/watch?v=PwiJYkLNzZA&ab_channel=NewOrleansCityCouncil
2:49:33,um we also are working with them this was our first joint product a the historical,https://www.youtube.com/watch?v=PwiJYkLNzZA&ab_channel=NewOrleansCityCouncil
2:49:39,murder dashboard one of the things that the data ordinance requested was for nopd to provide,https://www.youtube.com/watch?v=PwiJYkLNzZA&ab_channel=NewOrleansCityCouncil
2:49:45,data on homicides and so you can see that uh we're working with them they're providing on a monthly basis their,https://www.youtube.com/watch?v=PwiJYkLNzZA&ab_channel=NewOrleansCityCouncil
2:49:52,spreadsheet that they keep track of where they're tracking all murders and this does a couple of things one it allows us to produce a product like this,https://www.youtube.com/watch?v=PwiJYkLNzZA&ab_channel=NewOrleansCityCouncil
2:49:59,which sits both on the council website and on the nopd website it also allows us to know in real time how many murders,https://www.youtube.com/watch?v=PwiJYkLNzZA&ab_channel=NewOrleansCityCouncil
2:50:06,there were Neo real time it doesn't sound like much but we've,https://www.youtube.com/watch?v=PwiJYkLNzZA&ab_channel=NewOrleansCityCouncil
2:50:12,gone months years even where there's very little actual hard information on,https://www.youtube.com/watch?v=PwiJYkLNzZA&ab_channel=NewOrleansCityCouncil
2:50:18,just how many of the worst crime in the city has happened and now we're able to say month to month how many victims,https://www.youtube.com/watch?v=PwiJYkLNzZA&ab_channel=NewOrleansCityCouncil
2:50:24,there have been with eight you know information on the demographics age the weapons used things like that and we're,https://www.youtube.com/watch?v=PwiJYkLNzZA&ab_channel=NewOrleansCityCouncil
2:50:30,able to push that out to the public which allows for Less uncertainty it,https://www.youtube.com/watch?v=PwiJYkLNzZA&ab_channel=NewOrleansCityCouncil
2:50:35,allows for a better understanding of what's happening what the trends look like and,https://www.youtube.com/watch?v=PwiJYkLNzZA&ab_channel=NewOrleansCityCouncil
2:50:40,um I think that this is useful both for people that just want to stay up to date it's useful for researchers it's useful,https://www.youtube.com/watch?v=PwiJYkLNzZA&ab_channel=NewOrleansCityCouncil
2:50:45,for journalists and it's useful for me myself a data analyst who just wants to be able to follow things nopd has also,https://www.youtube.com/watch?v=PwiJYkLNzZA&ab_channel=NewOrleansCityCouncil
2:50:54,produced data on facial recognition they're producing that data quarterly so just a couple weeks ago we got the,https://www.youtube.com/watch?v=PwiJYkLNzZA&ab_channel=NewOrleansCityCouncil
2:51:00,fourth quarter data from facial recognition we're able to turn around a very quick analysis and send that to all,https://www.youtube.com/watch?v=PwiJYkLNzZA&ab_channel=NewOrleansCityCouncil
2:51:05,of you council members on use of facial recognition or I guess non-use mostly facial recognition in the fourth quarter,https://www.youtube.com/watch?v=PwiJYkLNzZA&ab_channel=NewOrleansCityCouncil
2:51:11,of 2022 that's the type of thing that I think will be most useful when we look,https://www.youtube.com/watch?v=PwiJYkLNzZA&ab_channel=NewOrleansCityCouncil
2:51:16,back in October of this year and we have a full year of data and can actually provide that so very useful to be able,https://www.youtube.com/watch?v=PwiJYkLNzZA&ab_channel=NewOrleansCityCouncil
2:51:22,to have that data um if I did miss any data sets you know certainly ask about them and I'm happy,https://www.youtube.com/watch?v=PwiJYkLNzZA&ab_channel=NewOrleansCityCouncil
2:51:29,to say whether or not an OPD is providing them um the Sheriff's Office continues to provide data access to their Data,https://www.youtube.com/watch?v=PwiJYkLNzZA&ab_channel=NewOrleansCityCouncil
2:51:35,Systems which allows for the jail dashboard it allows for um pretty much all of the dashboards to,https://www.youtube.com/watch?v=PwiJYkLNzZA&ab_channel=NewOrleansCityCouncil
2:51:41,be honest to function um the our work through the the Sheriff's Office allows access to the,https://www.youtube.com/watch?v=PwiJYkLNzZA&ab_channel=NewOrleansCityCouncil
2:51:46,court data so we're able to see what's happening within the criminal court um unfortunately we still don't have any,https://www.youtube.com/watch?v=PwiJYkLNzZA&ab_channel=NewOrleansCityCouncil
2:51:53,access to municipal or traffic court data but when we have requested that data they've been more than willing to,https://www.youtube.com/watch?v=PwiJYkLNzZA&ab_channel=NewOrleansCityCouncil
2:51:59,provide it it's just that we don't sort of proactively have access to it in ways that we have for other,https://www.youtube.com/watch?v=PwiJYkLNzZA&ab_channel=NewOrleansCityCouncil
2:52:05,sources um the District Attorney's Office you know full disclosure we do have a,https://www.youtube.com/watch?v=PwiJYkLNzZA&ab_channel=NewOrleansCityCouncil
2:52:11,Consulting relationship with the District Attorney's office as well have access to their data through that means,https://www.youtube.com/watch?v=PwiJYkLNzZA&ab_channel=NewOrleansCityCouncil
2:52:16,um the there's not many circumstances where the court data and the DA's data,https://www.youtube.com/watch?v=PwiJYkLNzZA&ab_channel=NewOrleansCityCouncil
2:52:23,we can usually get what we need through the court so I can't think of any circumstances where we've needed to have,https://www.youtube.com/watch?v=PwiJYkLNzZA&ab_channel=NewOrleansCityCouncil
2:52:28,access to something from the DA's office that we haven't been able to access through the court data,https://www.youtube.com/watch?v=PwiJYkLNzZA&ab_channel=NewOrleansCityCouncil
2:52:34,um the good example being when when the 701s popped up as an issue about a year ago we were able through the court to,https://www.youtube.com/watch?v=PwiJYkLNzZA&ab_channel=NewOrleansCityCouncil
2:52:41,analyze it and respond to your questions using just the court data not relying on the DA's data at the time,https://www.youtube.com/watch?v=PwiJYkLNzZA&ab_channel=NewOrleansCityCouncil
2:52:48,um and then the juvenile court being the last one which I think is the most challenging for us just because until,https://www.youtube.com/watch?v=PwiJYkLNzZA&ab_channel=NewOrleansCityCouncil
2:52:54,the end of 2021 the juvenile court was using a system um and they switched to a new system,https://www.youtube.com/watch?v=PwiJYkLNzZA&ab_channel=NewOrleansCityCouncil
2:53:01,through digicort which is also what I believe uh trafficking Municipal Court are using and you can access all the,https://www.youtube.com/watch?v=PwiJYkLNzZA&ab_channel=NewOrleansCityCouncil
2:53:08,data you can a kid gets arrested the the use you know somebody juvenile court can,https://www.youtube.com/watch?v=PwiJYkLNzZA&ab_channel=NewOrleansCityCouncil
2:53:13,type up the name see all the cases they've been involved in see uh with this this case status is from our,https://www.youtube.com/watch?v=PwiJYkLNzZA&ab_channel=NewOrleansCityCouncil
2:53:19,perspective as data analysts though we can't export the data so through from,https://www.youtube.com/watch?v=PwiJYkLNzZA&ab_channel=NewOrleansCityCouncil
2:53:24,2012 through 2021 we were able to export data and make things like when we wanted to analyze what share of arrest,https://www.youtube.com/watch?v=PwiJYkLNzZA&ab_channel=NewOrleansCityCouncil
2:53:30,city-wide were juveniles what share of vehicle burglaries are being committed by juveniles or vehicle burglary arrests,https://www.youtube.com/watch?v=PwiJYkLNzZA&ab_channel=NewOrleansCityCouncil
2:53:36,are being committed by juveniles um we were able to do that until the start of 2022 now what we're able to do,https://www.youtube.com/watch?v=PwiJYkLNzZA&ab_channel=NewOrleansCityCouncil
2:53:44,is basically we have to download it we we do a full month month or a full year we're able to isolate just the item,https://www.youtube.com/watch?v=PwiJYkLNzZA&ab_channel=NewOrleansCityCouncil
2:53:50,numbers and so we can do a little bit of analysis by just finding what the item numbers are and so I can tell you whether or not a case was an adult or a,https://www.youtube.com/watch?v=PwiJYkLNzZA&ab_channel=NewOrleansCityCouncil
2:53:58,juvenile arrest through additional analysis but we can't do things like track juvenile arrests over time,https://www.youtube.com/watch?v=PwiJYkLNzZA&ab_channel=NewOrleansCityCouncil
2:54:05,um how it compares to adult arrests or another thing that we're able to do is we were able to tell how many juveniles,https://www.youtube.com/watch?v=PwiJYkLNzZA&ab_channel=NewOrleansCityCouncil
2:54:11,were incarcerated in any one day from I believe 2014 or 2015 through the end of,https://www.youtube.com/watch?v=PwiJYkLNzZA&ab_channel=NewOrleansCityCouncil
2:54:16,2021 we're no longer able to do that systemically I believe through their program that you can do if I wanted to,https://www.youtube.com/watch?v=PwiJYkLNzZA&ab_channel=NewOrleansCityCouncil
2:54:23,check today I could see that but I can't go back and see December 6 2022 how many people were in cars how many juveniles,https://www.youtube.com/watch?v=PwiJYkLNzZA&ab_channel=NewOrleansCityCouncil
2:54:29,were incarcerated so from our end it is problematic it hasn't been,https://www.youtube.com/watch?v=PwiJYkLNzZA&ab_channel=NewOrleansCityCouncil
2:54:35,um the biggest issue just because there hasn't been any major issue that we've tried to analyze but it is sort of a,https://www.youtube.com/watch?v=PwiJYkLNzZA&ab_channel=NewOrleansCityCouncil
2:54:41,black hole if we were asked to analyze a specific issue related to juvenile arrests or juvenile incarceration we,https://www.youtube.com/watch?v=PwiJYkLNzZA&ab_channel=NewOrleansCityCouncil
2:54:48,would struggle to be able to analyze that from the available data right now uh I think before I yield to the council,https://www.youtube.com/watch?v=PwiJYkLNzZA&ab_channel=NewOrleansCityCouncil
2:54:53,vice president for some questions I think that what's very interesting is and this is probably an over uh probably,https://www.youtube.com/watch?v=PwiJYkLNzZA&ab_channel=NewOrleansCityCouncil
2:55:00,something that Council overlooked we operate it with the assumptions as the city is funding all these respective,https://www.youtube.com/watch?v=PwiJYkLNzZA&ab_channel=NewOrleansCityCouncil
2:55:06,courts that we're operating off a unified system and I think it's important to note that many of our,https://www.youtube.com/watch?v=PwiJYkLNzZA&ab_channel=NewOrleansCityCouncil
2:55:13,partners at least operate on systems that to a large degree communicate with each,https://www.youtube.com/watch?v=PwiJYkLNzZA&ab_channel=NewOrleansCityCouncil
2:55:18,other so the challenge you're having with two different groups which Municipal and traffic court as one group,https://www.youtube.com/watch?v=PwiJYkLNzZA&ab_channel=NewOrleansCityCouncil
2:55:23,and juvenile court is that they operate on a different system that,https://www.youtube.com/watch?v=PwiJYkLNzZA&ab_channel=NewOrleansCityCouncil
2:55:29,does not really allow for the export exporting data for analysis now one bit,https://www.youtube.com/watch?v=PwiJYkLNzZA&ab_channel=NewOrleansCityCouncil
2:55:34,Municipal and traffic get on their current system that is similar to juvenile court that I don't know I think,https://www.youtube.com/watch?v=PwiJYkLNzZA&ab_channel=NewOrleansCityCouncil
2:55:39,they've been on it for years um certainly as long as I've been working with the council as a consultant,https://www.youtube.com/watch?v=PwiJYkLNzZA&ab_channel=NewOrleansCityCouncil
2:55:45,I I think it's kind of a missed opportunity because we had a similar issue during budget we,https://www.youtube.com/watch?v=PwiJYkLNzZA&ab_channel=NewOrleansCityCouncil
2:55:51,have the sheriff's office here and there was an effort as we were trying to put like the the final touch on the unified,https://www.youtube.com/watch?v=PwiJYkLNzZA&ab_channel=NewOrleansCityCouncil
2:55:59,system of our criminal justice Partners where I think the sheriff proposed going to a whole different system and the,https://www.youtube.com/watch?v=PwiJYkLNzZA&ab_channel=NewOrleansCityCouncil
2:56:05,council pretty definitively push back on that saying that as a city of New Orleans if,https://www.youtube.com/watch?v=PwiJYkLNzZA&ab_channel=NewOrleansCityCouncil
2:56:11,we're going to fund these these systems that process and collect data they have,https://www.youtube.com/watch?v=PwiJYkLNzZA&ab_channel=NewOrleansCityCouncil
2:56:17,to be the goal is to try and have everyone on the same system for a variety of reasons one is obviously for,https://www.youtube.com/watch?v=PwiJYkLNzZA&ab_channel=NewOrleansCityCouncil
2:56:23,the for exporting and collecting data and the aggregate so we can analyze and,https://www.youtube.com/watch?v=PwiJYkLNzZA&ab_channel=NewOrleansCityCouncil
2:56:28,have accountability but on the other hand when you have multiple systems that means you have to have multiple contracts for individuals to maintain,https://www.youtube.com/watch?v=PwiJYkLNzZA&ab_channel=NewOrleansCityCouncil
2:56:36,and operate those systems which is another problem with lacking uniformity so I think something will have to work,https://www.youtube.com/watch?v=PwiJYkLNzZA&ab_channel=NewOrleansCityCouncil
2:56:43,off work on offline Jeff is maybe revisiting the data ordinance to require everyone to be on exportable systems,https://www.youtube.com/watch?v=PwiJYkLNzZA&ab_channel=NewOrleansCityCouncil
2:56:50,because I think that is going to be increasingly problematic that as the other agencies provide the data that you,https://www.youtube.com/watch?v=PwiJYkLNzZA&ab_channel=NewOrleansCityCouncil
2:56:57,request I think it's going to be challenging to parse data if it's not set an exportable,https://www.youtube.com/watch?v=PwiJYkLNzZA&ab_channel=NewOrleansCityCouncil
2:57:02,format and that will delay our ability to respond to the public or media,https://www.youtube.com/watch?v=PwiJYkLNzZA&ab_channel=NewOrleansCityCouncil
2:57:08,regarding a quest request for certain data Council vice president,https://www.youtube.com/watch?v=PwiJYkLNzZA&ab_channel=NewOrleansCityCouncil
2:57:14,thank you Mr President um Jeff for the for the ones where the data,https://www.youtube.com/watch?v=PwiJYkLNzZA&ab_channel=NewOrleansCityCouncil
2:57:19,can't be exported can't these agencies just give you just direct access would,https://www.youtube.com/watch?v=PwiJYkLNzZA&ab_channel=NewOrleansCityCouncil
2:57:24,that be a helpful way uh I'm not sure we haven't really explored that with juvenile court,https://www.youtube.com/watch?v=PwiJYkLNzZA&ab_channel=NewOrleansCityCouncil
2:57:30,um the I'm not sure how their data is stored or if there's a way to receive sort of that back-end access in ways,https://www.youtube.com/watch?v=PwiJYkLNzZA&ab_channel=NewOrleansCityCouncil
2:57:37,that we have through other means um it's I guess possible but yeah it didn't,https://www.youtube.com/watch?v=PwiJYkLNzZA&ab_channel=NewOrleansCityCouncil
2:57:44,used to be an issue so there was never any reason to explore it because under the old system sure just select the,https://www.youtube.com/watch?v=PwiJYkLNzZA&ab_channel=NewOrleansCityCouncil
2:57:50,dates export it analyze it yeah well to the president's point it's like we,https://www.youtube.com/watch?v=PwiJYkLNzZA&ab_channel=NewOrleansCityCouncil
2:57:56,need to figure out a path for you to be able to get the data that you need to be able to do the correct type of analytics,https://www.youtube.com/watch?v=PwiJYkLNzZA&ab_channel=NewOrleansCityCouncil
2:58:01,and if we need to revisit the data ordinance we'll do so you briefly mentioned in your presentation uh Jeff,https://www.youtube.com/watch?v=PwiJYkLNzZA&ab_channel=NewOrleansCityCouncil
2:58:08,something that piqued my interest you talked about the,https://www.youtube.com/watch?v=PwiJYkLNzZA&ab_channel=NewOrleansCityCouncil
2:58:13,fourth quarter report for facial recognition now the the facial recognition technology is something that,https://www.youtube.com/watch?v=PwiJYkLNzZA&ab_channel=NewOrleansCityCouncil
2:58:20,is recently being utilized by uh the nopd what are the initial uh reports,https://www.youtube.com/watch?v=PwiJYkLNzZA&ab_channel=NewOrleansCityCouncil
2:58:27,showing you what kind of start is it off to uh so from the data that we received,https://www.youtube.com/watch?v=PwiJYkLNzZA&ab_channel=NewOrleansCityCouncil
2:58:32,from nopd we saw that there were six requests for facial recognition in the fourth quarter so it was October through,https://www.youtube.com/watch?v=PwiJYkLNzZA&ab_channel=NewOrleansCityCouncil
2:58:38,December 2022 um of those six requests I believe and I don't have the the spreadsheet in front,https://www.youtube.com/watch?v=PwiJYkLNzZA&ab_channel=NewOrleansCityCouncil
2:58:45,of me um I believe that there were three matches and one of those matches was an,https://www.youtube.com/watch?v=PwiJYkLNzZA&ab_channel=NewOrleansCityCouncil
2:58:52,incorrect match that nopd was able to through their process to their credit was able to identify that the match was,https://www.youtube.com/watch?v=PwiJYkLNzZA&ab_channel=NewOrleansCityCouncil
2:58:58,incorrect um so they had two matches and I believe of those they're still investigating all,https://www.youtube.com/watch?v=PwiJYkLNzZA&ab_channel=NewOrleansCityCouncil
2:59:04,of them so they have no arrests as of I don't know exactly when the data was produced and sent but,https://www.youtube.com/watch?v=PwiJYkLNzZA&ab_channel=NewOrleansCityCouncil
2:59:11,um right now my understanding is that there's zero rest from those so uh you,https://www.youtube.com/watch?v=PwiJYkLNzZA&ab_channel=NewOrleansCityCouncil
2:59:17,know reasonably light I guess usage of the facial recognition so far no hits but I think again we're,https://www.youtube.com/watch?v=PwiJYkLNzZA&ab_channel=NewOrleansCityCouncil
2:59:24,talking about having three months of actual data and so it's hard to say whether officers are are just slow to,https://www.youtube.com/watch?v=PwiJYkLNzZA&ab_channel=NewOrleansCityCouncil
2:59:31,adopt it whether or not they're going to adopt it more whether or not they're gonna use it for a wider variety of,https://www.youtube.com/watch?v=PwiJYkLNzZA&ab_channel=NewOrleansCityCouncil
2:59:37,incidents or become better accustomed to which incidents they can put forward yeah really hard to say it's something,https://www.youtube.com/watch?v=PwiJYkLNzZA&ab_channel=NewOrleansCityCouncil
2:59:43,that that as an analyst we look forward to being able to Monitor and be able to draw more firm conclusions I would hate,https://www.youtube.com/watch?v=PwiJYkLNzZA&ab_channel=NewOrleansCityCouncil
2:59:48,to jump to any firm conclusion based on just three months of data but that's what we've seen so far yeah yeah no,https://www.youtube.com/watch?v=PwiJYkLNzZA&ab_channel=NewOrleansCityCouncil
2:59:54,doubt and and I you know I agree with you that it's like what we'll keep taking a look at what's what's happening,https://www.youtube.com/watch?v=PwiJYkLNzZA&ab_channel=NewOrleansCityCouncil
